"  User:  Javier Ressogola    Last Refresh:  Saturday, November 1, 2025, 0:00:00",,,,,,,
OrderID,CustomerID,CustomerName,ProductID,Quantity,OrderDate,RequestedDeliveryDate,Comments
O172000,C0301,Customer 301,P0786,19,10-08-2025,10-15-2025,Pay in 90 days
O172001,C0386,Customer 386,P0848,3,10-19-2025,20/10/2025,
O172002,C0903,Customer 903,P0721,5,05/10/2025,2025-10-06,Pay in 90 days
O172003,C0034,Customer 34,P0465,1,10-13-2025,2025-10-16,Inform customer once order is sent
O172004,C0025,Customer 25,P0504,15,10-16-2025,18/10/2025,Inform customer once order is sent
O172005,C0303,Customer 303,P0598,11,2025-10-17,2025-10-25,Pay in 90 days
O172006,C0395,Customer 395,P0430,18,20/10/2025,28/10/2025,Pay in 90 days
O172007,C0268,Customer 268,P0438,3,10-16-2025,10-20-2025,Pay in 90 days
O172008,C0152,Customer 152,P0389,7,20/10/2025,27/10/2025,Inform customer once order is sent
O172009,C0162,Customer 162,P0108,18,2025-10-23,10-25-2025,
O172010,C0563,Customer 563,P0551,6,2025-10-09,13/10/2025,Inform customer once order is sent
O172011,C0204,Customer 204,P0430,20,06/10/2025,2025-10-11,Pay in 90 days
O172012,C0458,Customer 458,P0515,16,10-18-2025,10-26-2025,Inform customer once order is sent
O172013,C0770,Customer 770,P0339,16,2025-10-14,10-15-2025,Pay in 90 days
O172014,C0003,Customer 3,P0757,6,10-20-2025,2025-10-23,Inform customer once order is sent
O172015,C0871,Customer 871,P0875,7,22/10/2025,2025-10-27,
O172016,C0797,Customer 797,P0250,17,10-20-2025,2025-10-28,Inform customer once order is sent
O172017,C0855,Customer 855,P0701,18,10-27-2025,04/11/2025,
O172018,C0996,Customer 996,P0705,1,09/10/2025,10-10-2025,
O172019,C0204,Customer 204,P0790,16,2025-10-18,25/10/2025,Inform customer once order is sent
O172020,C0851,Customer 851,P0279,15,2025-10-06,10/10/2025,
O172021,C0939,Customer 939,P0203,14,2025-10-24,2025-11-02,Pay in 90 days
O172022,C0462,Customer 462,P0109,11,01/10/2025,2025-10-11,Pay in 90 days
O172023,C0535,Customer 535,P0653,3,10-12-2025,2025-10-16,Inform customer once order is sent
O172024,C0742,Customer 742,P0141,14,05/10/2025,09/10/2025,
O172025,C0522,Customer 522,P0503,17,10-17-2025,24/10/2025,Pay in 90 days
O172026,C0262,Customer 262,P0865,15,10-15-2025,2025-10-20,
O172027,C0873,Customer 873,P0865,11,2025-10-15,2025-10-22,Inform customer once order is sent
O172028,C0456,Customer 456,P0295,19,10-20-2025,2025-10-25,Inform customer once order is sent
O172029,C0902,Customer 902,P0873,16,2025-10-17,2025-10-25,
O172030,C0596,Customer 596,P0376,1,04/10/2025,2025-10-13,Pay in 90 days
O172031,C0553,Customer 553,P0413,11,05/10/2025,14/10/2025,
O172032,C0623,Customer 623,P0078,20,21/10/2025,25/10/2025,Pay in 90 days
O172033,C0153,Customer 153,P0409,5,2025-10-20,10-23-2025,Inform customer once order is sent
O172034,C0219,Customer 219,P0577,19,2025-10-28,2025-11-07,
O172035,C0479,Customer 479,P0382,3,23/10/2025,10-31-2025,
O172036,C0224,Customer 224,P0409,2,10-14-2025,2025-10-19,Pay in 90 days
O172037,C0473,Customer 473,P0185,18,2025-10-11,2025-10-18,Inform customer once order is sent
O172038,C0772,Customer 772,P0110,13,13/10/2025,2025-10-17,
O172039,C0219,Customer 219,P0178,16,17/10/2025,2025-10-18,Pay in 90 days
O172040,C0887,Customer 887,P0045,1,2025-10-24,10-27-2025,Pay in 90 days
O172041,C0686,Customer 686,P0319,15,10-19-2025,20/10/2025,Pay in 90 days
O172042,C0404,Customer 404,P0580,1,2025-10-12,10-14-2025,Pay in 90 days
O172043,C0806,Customer 806,P0473,14,10-20-2025,2025-10-29,Inform customer once order is sent
O172044,C0375,Customer 375,P0227,16,01/10/2025,10-03-2025,Pay in 90 days
O172045,C0853,Customer 853,P0811,20,28/10/2025,11-05-2025,Inform customer once order is sent
O172046,C0351,Customer 351,P0541,5,2025-10-23,2025-11-01,Inform customer once order is sent
O172047,C0129,Customer 129,P0074,14,2025-10-28,04/11/2025,
O172048,C0251,Customer 251,P0734,20,2025-10-20,10-29-2025,Pay in 90 days
O172049,C0317,Customer 317,P0813,17,21/10/2025,2025-10-26,Inform customer once order is sent
O172050,C0507,Customer 507,P0019,13,10-19-2025,21/10/2025,Pay in 90 days
O172051,C0501,Customer 501,P0179,4,2025-10-04,05/10/2025,Inform customer once order is sent
O172052,C0202,Customer 202,P0711,19,10-15-2025,2025-10-24,
O172053,C0656,Customer 656,P0119,15,10-04-2025,13/10/2025,Inform customer once order is sent
O172054,C0036,Customer 36,P0872,18,22/10/2025,30/10/2025,Pay in 90 days
O172055,C0638,Customer 638,P0708,6,2025-10-12,14/10/2025,Inform customer once order is sent
O172056,C0876,Customer 876,P0851,17,10-23-2025,30/10/2025,Inform customer once order is sent
O172057,C0765,Customer 765,P0668,16,2025-10-20,2025-10-29,
O172058,C0619,Customer 619,P0709,16,2025-10-27,10-30-2025,Inform customer once order is sent
O172059,C0490,Customer 490,P0294,5,10-28-2025,11-01-2025,Pay in 90 days
O172060,C0468,Customer 468,P0259,3,2025-10-12,10-13-2025,Inform customer once order is sent
O172061,C0263,Customer 263,P0157,15,2025-10-07,2025-10-10,
O172062,C0226,Customer 226,P0059,20,24/10/2025,28/10/2025,Pay in 90 days
O172063,C0045,Customer 45,P0799,18,23/10/2025,10-26-2025,Inform customer once order is sent
O172064,C0083,Customer 83,P0005,14,10/10/2025,2025-10-19,Inform customer once order is sent
O172065,C0802,Customer 802,P0781,5,2025-10-10,10-20-2025,Pay in 90 days
O172066,C0009,Customer 9,P0809,6,10-02-2025,2025-10-12,
O172067,C0218,Customer 218,P0438,8,22/10/2025,10-29-2025,Inform customer once order is sent
O172068,C0679,Customer 679,P0173,20,10-09-2025,10/10/2025,Pay in 90 days
O172069,C0039,Customer 39,P0531,11,23/10/2025,29/10/2025,
O172070,C0824,Customer 824,P0871,2,2025-10-01,06/10/2025,Pay in 90 days
O172071,C0445,Customer 445,P0223,9,2025-10-07,10-08-2025,
O172072,C0943,Customer 943,P0056,14,10-05-2025,2025-10-15,Pay in 90 days
O172073,C0145,Customer 145,P0209,8,10-27-2025,2025-11-06,
O172074,C0632,Customer 632,P0405,6,02/10/2025,2025-10-08,
O172075,C0807,Customer 807,P0042,2,10-20-2025,25/10/2025,Pay in 90 days
O172076,C0235,Customer 235,P0882,1,01/10/2025,2025-10-11,
O172077,C0903,Customer 903,P0433,11,10-18-2025,2025-10-23,
O172078,C0274,Customer 274,P0648,4,2025-10-21,2025-10-24,
O172079,C0936,Customer 936,P0718,3,23/10/2025,01/11/2025,
O172080,C0982,Customer 982,P0441,1,2025-10-17,10-18-2025,Pay in 90 days
O172081,C0228,Customer 228,P0147,14,19/10/2025,28/10/2025,Pay in 90 days
O172082,C0292,Customer 292,P0431,5,2025-10-22,2025-10-27,Inform customer once order is sent
O172083,C0809,Customer 809,P0163,14,10-11-2025,16/10/2025,Inform customer once order is sent
O172084,C0200,Customer 200,P0225,12,2025-10-10,2025-10-18,
O172085,C0124,Customer 124,P0263,2,2025-10-17,10-27-2025,Inform customer once order is sent
O172086,C0832,Customer 832,P0166,18,13/10/2025,10-14-2025,
O172087,C0837,Customer 837,P0098,4,2025-10-19,20/10/2025,Inform customer once order is sent
O172088,C0697,Customer 697,P0305,17,28/10/2025,2025-11-02,Inform customer once order is sent
O172089,C0782,Customer 782,P0506,5,12/10/2025,10-19-2025,Inform customer once order is sent
O172090,C0090,Customer 90,P0070,5,19/10/2025,25/10/2025,Inform customer once order is sent
O172091,C0202,Customer 202,P0579,18,2025-10-07,2025-10-16,
O172092,C0103,Customer 103,P0270,15,06/10/2025,10/10/2025,Pay in 90 days
O172093,C0409,Customer 409,P0542,2,27/10/2025,11-05-2025,Pay in 90 days
O172094,C0500,Customer 500,P0065,2,2025-10-07,11/10/2025,
O172095,C0271,Customer 271,P0703,15,10-19-2025,25/10/2025,Inform customer once order is sent
O172096,C0990,Customer 990,P0263,13,15/10/2025,2025-10-22,
O172097,C0228,Customer 228,P0841,6,2025-10-20,2025-10-21,Inform customer once order is sent
O172098,C0797,Customer 797,P0301,4,28/10/2025,31/10/2025,Inform customer once order is sent
O172099,C0412,Customer 412,P0738,17,07/10/2025,2025-10-16,Inform customer once order is sent
O172100,C0154,Customer 154,P0378,8,10-01-2025,2025-10-08,
O172101,C0929,Customer 929,P0739,3,04/10/2025,10/10/2025,Inform customer once order is sent
O172102,C0117,Customer 117,P0283,20,2025-10-26,2025-10-27,
O172103,C0339,Customer 339,P0369,16,20/10/2025,2025-10-23,Pay in 90 days
O172104,C0250,Customer 250,P0593,18,2025-10-22,10-31-2025,
O172105,C0728,Customer 728,P0219,8,10-19-2025,10-23-2025,Inform customer once order is sent
O172106,C0615,Customer 615,P0127,5,10-07-2025,13/10/2025,Inform customer once order is sent
O172107,C0058,Customer 58,P0267,14,2025-10-26,2025-10-27,Pay in 90 days
O172108,C0381,Customer 381,P0113,7,03/10/2025,10-11-2025,
O172109,C0663,Customer 663,P0732,13,2025-10-16,10-19-2025,Inform customer once order is sent
O172110,C0784,Customer 784,P0208,13,10-19-2025,2025-10-28,Inform customer once order is sent
O172111,C0573,Customer 573,P0322,1,2025-10-08,2025-10-11,
O172112,C0886,Customer 886,P0417,3,15/10/2025,10-25-2025,Inform customer once order is sent
O172113,C0372,Customer 372,P0366,18,24/10/2025,2025-10-27,Pay in 90 days
O172114,C0493,Customer 493,P0380,6,2025-10-20,10-21-2025,
O172115,C0519,Customer 519,P0025,5,09/10/2025,10-19-2025,Pay in 90 days
O172116,C0335,Customer 335,P0859,20,2025-10-28,2025-11-06,Inform customer once order is sent
O172117,C0230,Customer 230,P0381,18,21/10/2025,2025-10-30,
O172118,C0337,Customer 337,P0357,9,16/10/2025,20/10/2025,Pay in 90 days
O172119,C0975,Customer 975,P0744,6,2025-10-13,10-17-2025,Pay in 90 days
O172120,C0955,Customer 955,P0063,20,10-04-2025,10-11-2025,
O172121,C0489,Customer 489,P0679,6,10-16-2025,2025-10-24,Pay in 90 days
O172122,C0954,Customer 954,P0401,5,06/10/2025,2025-10-09,Inform customer once order is sent
O172123,C0475,Customer 475,P0429,15,2025-10-13,22/10/2025,Pay in 90 days
O172124,C0409,Customer 409,P0416,20,10-06-2025,09/10/2025,
O172125,C0356,Customer 356,P0065,19,2025-10-21,2025-10-27,
O172126,C0037,Customer 37,P0659,14,2025-10-01,11/10/2025,Inform customer once order is sent
O172127,C0996,Customer 996,P0352,14,2025-10-09,2025-10-19,Pay in 90 days
O172128,C0063,Customer 63,P0201,20,10-27-2025,04/11/2025,
O172129,C0004,Customer 4,P0018,5,10-19-2025,2025-10-20,Inform customer once order is sent
O172130,C0322,Customer 322,P0227,20,14/10/2025,2025-10-21,Pay in 90 days
O172131,C0995,Customer 995,P0391,1,2025-10-17,2025-10-27,Pay in 90 days
O172132,C0856,Customer 856,P0634,4,2025-10-17,24/10/2025,
O172133,C0030,Customer 30,P0664,16,25/10/2025,11-04-2025,Inform customer once order is sent
O172134,C0190,Customer 190,P0188,17,27/10/2025,03/11/2025,Inform customer once order is sent
O172135,C0413,Customer 413,P0644,13,10-18-2025,10-26-2025,
O172136,C0678,Customer 678,P0552,3,2025-10-19,22/10/2025,Inform customer once order is sent
O172137,C0545,Customer 545,P0580,1,10-28-2025,11-02-2025,Pay in 90 days
O172138,C0356,Customer 356,P0080,18,11/10/2025,10-19-2025,Inform customer once order is sent
O172139,C0967,Customer 967,P0552,3,10-16-2025,10-21-2025,
O172140,C0728,Customer 728,P0577,17,2025-10-17,25/10/2025,
O172141,C0682,Customer 682,P0395,18,24/10/2025,03/11/2025,
O172142,C0331,Customer 331,P0653,7,10-16-2025,10-26-2025,Inform customer once order is sent
O172143,C0344,Customer 344,P0257,2,2025-10-12,10-16-2025,Pay in 90 days
O172144,C0168,Customer 168,P0484,17,10-08-2025,2025-10-13,Pay in 90 days
O172145,C0933,Customer 933,P0515,12,10-12-2025,17/10/2025,Pay in 90 days
O172146,C0590,Customer 590,P0398,6,2025-10-28,10-30-2025,
O172147,C0192,Customer 192,P0248,13,23/10/2025,31/10/2025,Pay in 90 days
O172148,C0571,Customer 571,P0688,16,2025-10-06,10-08-2025,
O172149,C0860,Customer 860,P0811,16,2025-10-15,2025-10-19,Pay in 90 days
O172150,C0365,Customer 365,P0599,14,09/10/2025,16/10/2025,Pay in 90 days
O172151,C0808,Customer 808,P0334,19,2025-10-08,12/10/2025,
O172152,C0680,Customer 680,P0851,4,12/10/2025,2025-10-14,Inform customer once order is sent
O172153,C0914,Customer 914,P0578,19,07/10/2025,2025-10-15,Inform customer once order is sent
O172154,C0724,Customer 724,P0817,7,2025-10-13,10-21-2025,
O172155,C0646,Customer 646,P0103,6,10-21-2025,10-23-2025,Inform customer once order is sent
O172156,C0741,Customer 741,P0750,11,2025-10-03,06/10/2025,Pay in 90 days
O172157,C0211,Customer 211,P0004,3,09/10/2025,16/10/2025,
O172158,C0911,Customer 911,P0233,11,10-12-2025,18/10/2025,Inform customer once order is sent
O172159,C0577,Customer 577,P0124,19,10-05-2025,2025-10-12,Pay in 90 days
O172160,C0873,Customer 873,P0158,19,2025-10-23,27/10/2025,Inform customer once order is sent
O172161,C0964,Customer 964,P0449,15,28/10/2025,10-29-2025,Pay in 90 days
O172162,C0112,Customer 112,P0546,13,10-07-2025,2025-10-17,Pay in 90 days
O172163,C0025,Customer 25,P0232,1,14/10/2025,2025-10-17,Inform customer once order is sent
O172164,C0066,Customer 66,P0718,4,2025-10-11,17/10/2025,Inform customer once order is sent
O172165,C0650,Customer 650,P0707,12,2025-10-01,03/10/2025,
O172166,C0057,Customer 57,P0646,2,10-28-2025,2025-11-07,Inform customer once order is sent
O172167,C0653,Customer 653,P0460,6,18/10/2025,19/10/2025,
O172168,C0080,Customer 80,P0091,11,2025-10-06,15/10/2025,
O172169,C0741,Customer 741,P0125,14,10-28-2025,11-07-2025,Inform customer once order is sent
O172170,C0507,Customer 507,P0342,13,10-25-2025,2025-10-30,
O172171,C0862,Customer 862,P0121,20,2025-10-20,10-25-2025,
O172172,C0874,Customer 874,P0464,13,19/10/2025,10-24-2025,Pay in 90 days
O172173,C0607,Customer 607,P0102,2,2025-10-20,2025-10-29,
O172174,C0458,Customer 458,P0661,20,10-21-2025,10-26-2025,
O172175,C0832,Customer 832,P0046,16,07/10/2025,10/10/2025,Pay in 90 days
O172176,C0341,Customer 341,P0368,13,10-28-2025,2025-11-06,Inform customer once order is sent
O172177,C0514,Customer 514,P0661,10,01/10/2025,05/10/2025,Inform customer once order is sent
O172178,C0634,Customer 634,P0799,20,02/10/2025,10-11-2025,Pay in 90 days
O172179,C0684,Customer 684,P0080,10,10-04-2025,09/10/2025,Inform customer once order is sent
O172180,C0076,Customer 76,P0437,5,2025-10-19,10-23-2025,
O172181,C0878,Customer 878,P0372,18,10-26-2025,2025-10-29,Pay in 90 days
O172182,C0440,Customer 440,P0471,10,09/10/2025,13/10/2025,Inform customer once order is sent
O172183,C0005,Customer 5,P0005,16,10-03-2025,10-12-2025,
O172184,C0543,Customer 543,P0541,16,19/10/2025,2025-10-24,
O172185,C0449,Customer 449,P0277,5,10-19-2025,2025-10-24,
O172186,C0360,Customer 360,P0206,14,10-24-2025,2025-10-29,Pay in 90 days
O172187,C0795,Customer 795,P0613,4,10-28-2025,2025-11-07,
O172188,C0806,Customer 806,P0589,13,20/10/2025,10-27-2025,Pay in 90 days
O172189,C0766,Customer 766,P0728,3,10-09-2025,10-11-2025,Inform customer once order is sent
O172190,C0394,Customer 394,P0424,12,06/10/2025,2025-10-12,
O172191,C0965,Customer 965,P0407,19,2025-10-26,05/11/2025,Pay in 90 days
O172192,C0931,Customer 931,P0582,20,2025-10-24,25/10/2025,Inform customer once order is sent
O172193,C0769,Customer 769,P0341,13,06/10/2025,07/10/2025,Pay in 90 days
O172194,C0736,Customer 736,P0412,15,2025-10-17,19/10/2025,Inform customer once order is sent
O172195,C0918,Customer 918,P0358,13,2025-10-13,10-23-2025,Pay in 90 days
O172196,C0591,Customer 591,P0567,9,2025-10-06,2025-10-08,Inform customer once order is sent
O172197,C0398,Customer 398,P0889,12,19/10/2025,2025-10-28,Inform customer once order is sent
O172198,C0276,Customer 276,P0155,20,10-02-2025,2025-10-04,
O172199,C0734,Customer 734,P0841,16,2025-10-04,10-06-2025,
O172200,C0286,Customer 286,P0681,12,10-10-2025,10-12-2025,Pay in 90 days
O172201,C0615,Customer 615,P0265,14,2025-10-21,10-27-2025,Pay in 90 days
O172202,C0688,Customer 688,P0520,14,10-23-2025,11-01-2025,Pay in 90 days
O172203,C0492,Customer 492,P0122,16,10-10-2025,2025-10-16,
O172204,C0696,Customer 696,P0121,11,2025-10-24,31/10/2025,
O172205,C0733,Customer 733,P0060,2,2025-10-09,17/10/2025,
O172206,C0886,Customer 886,P0104,15,13/10/2025,14/10/2025,
O172207,C0882,Customer 882,P0417,7,10-28-2025,2025-11-03,Pay in 90 days
O172208,C0457,Customer 457,P0518,7,2025-10-22,10-26-2025,Inform customer once order is sent
O172209,C0201,Customer 201,P0661,11,22/10/2025,2025-10-25,Pay in 90 days
O172210,C0178,Customer 178,P0282,12,10-24-2025,10-29-2025,
O172211,C0271,Customer 271,P0789,15,09/10/2025,2025-10-14,
O172212,C0575,Customer 575,P0657,14,2025-10-17,10-18-2025,
O172213,C0513,Customer 513,P0644,15,2025-10-17,22/10/2025,Inform customer once order is sent
O172214,C0298,Customer 298,P0866,14,10-25-2025,2025-10-30,
O172215,C0236,Customer 236,P0624,6,19/10/2025,27/10/2025,Pay in 90 days
O172216,C0800,Customer 800,P0506,18,10-14-2025,15/10/2025,Pay in 90 days
O172217,C0911,Customer 911,P0252,11,10-19-2025,21/10/2025,Pay in 90 days
O172218,C0312,Customer 312,P0332,3,06/10/2025,10-13-2025,Inform customer once order is sent
O172219,C0903,Customer 903,P0875,14,10-25-2025,2025-10-28,Inform customer once order is sent
O172220,C0913,Customer 913,P0620,13,2025-10-16,10-18-2025,
O172221,C0106,Customer 106,P0675,14,2025-10-04,10-05-2025,
O172222,C0512,Customer 512,P0354,8,10-12-2025,10-21-2025,Pay in 90 days
O172223,C0625,Customer 625,P0611,10,2025-10-01,10-09-2025,Pay in 90 days
O172224,C0386,Customer 386,P0813,17,2025-10-18,10-27-2025,Inform customer once order is sent
O172225,C0668,Customer 668,P0575,13,10-12-2025,2025-10-21,Inform customer once order is sent
O172226,C0192,Customer 192,P0162,18,02/10/2025,08/10/2025,Pay in 90 days
O172227,C0358,Customer 358,P0107,19,14/10/2025,16/10/2025,Inform customer once order is sent
O172228,C0781,Customer 781,P0141,2,01/10/2025,02/10/2025,Inform customer once order is sent
O172229,C0401,Customer 401,P0569,11,10/10/2025,2025-10-18,Inform customer once order is sent
O172230,C0677,Customer 677,P0707,6,10-08-2025,2025-10-16,
O172231,C0674,Customer 674,P0528,2,22/10/2025,2025-10-31,Pay in 90 days
O172232,C0476,Customer 476,P0012,12,04/10/2025,2025-10-06,
O172233,C0108,Customer 108,P0834,7,2025-10-17,2025-10-19,
O172234,C0591,Customer 591,P0289,15,10-05-2025,10-07-2025,Pay in 90 days
O172235,C0497,Customer 497,P0673,12,18/10/2025,20/10/2025,Pay in 90 days
O172236,C0776,Customer 776,P0249,6,2025-10-14,10-24-2025,Pay in 90 days
O172237,C0675,Customer 675,P0062,10,10-14-2025,17/10/2025,Pay in 90 days
O172238,C0600,Customer 600,P0005,7,15/10/2025,10-17-2025,Inform customer once order is sent
O172239,C0738,Customer 738,P0788,2,10-10-2025,10-16-2025,Pay in 90 days
O172240,C0109,Customer 109,P0219,15,10-25-2025,2025-10-27,Pay in 90 days
O172241,C0191,Customer 191,P0568,20,25/10/2025,10-28-2025,Inform customer once order is sent
O172242,C0983,Customer 983,P0313,5,2025-10-11,2025-10-12,
O172243,C0819,Customer 819,P0783,19,10-12-2025,10-13-2025,Pay in 90 days
O172244,C0361,Customer 361,P0591,11,25/10/2025,02/11/2025,Inform customer once order is sent
O172245,C0279,Customer 279,P0715,15,2025-10-14,10-19-2025,
O172246,C0482,Customer 482,P0013,13,20/10/2025,10-27-2025,Pay in 90 days
O172247,C0185,Customer 185,P0760,18,01/10/2025,10-05-2025,Inform customer once order is sent
O172248,C0497,Customer 497,P0567,8,2025-10-24,2025-11-03,Pay in 90 days
O172249,C0912,Customer 912,P0157,11,10-27-2025,11-05-2025,Inform customer once order is sent
O172250,C0563,Customer 563,P0424,7,10-18-2025,2025-10-27,Pay in 90 days
O172251,C0242,Customer 242,P0519,18,26/10/2025,2025-11-03,
O172252,C0128,Customer 128,P0137,13,04/10/2025,10-12-2025,
O172253,C0866,Customer 866,P0676,17,28/10/2025,2025-11-04,Pay in 90 days
O172254,C0212,Customer 212,P0759,3,2025-10-21,25/10/2025,
O172255,C0269,Customer 269,P0768,3,2025-10-14,10-15-2025,Inform customer once order is sent
O172256,C0465,Customer 465,P0770,9,2025-10-12,2025-10-14,
O172257,C0892,Customer 892,P0895,17,2025-10-02,10-09-2025,Pay in 90 days
O172258,C0814,Customer 814,P0304,19,03/10/2025,08/10/2025,
O172259,C0385,Customer 385,P0330,2,2025-10-05,10-08-2025,
O172260,C0625,Customer 625,P0185,7,02/10/2025,2025-10-08,
O172261,C0791,Customer 791,P0287,2,10-07-2025,2025-10-17,
O172262,C0383,Customer 383,P0223,4,13/10/2025,2025-10-23,
O172263,C0394,Customer 394,P0549,17,2025-10-08,2025-10-13,Inform customer once order is sent
O172264,C0785,Customer 785,P0441,8,10-22-2025,2025-10-31,Pay in 90 days
O172265,C0587,Customer 587,P0185,20,16/10/2025,10-22-2025,Pay in 90 days
O172266,C0472,Customer 472,P0334,8,2025-10-15,2025-10-20,
O172267,C0181,Customer 181,P0658,5,2025-10-26,10-27-2025,
O172268,C0890,Customer 890,P0599,9,06/10/2025,2025-10-07,
O172269,C0227,Customer 227,P0354,8,10-16-2025,2025-10-23,
O172270,C0771,Customer 771,P0351,2,21/10/2025,27/10/2025,
O172271,C0558,Customer 558,P0779,7,01/10/2025,09/10/2025,Pay in 90 days
O172272,C0974,Customer 974,P0602,14,03/10/2025,10-06-2025,Pay in 90 days
O172273,C0851,Customer 851,P0048,11,2025-10-26,2025-10-30,Inform customer once order is sent
O172274,C0292,Customer 292,P0873,14,2025-10-14,2025-10-18,Pay in 90 days
O172275,C0013,Customer 13,P0175,7,2025-10-22,27/10/2025,
O172276,C0521,Customer 521,P0199,15,10-16-2025,20/10/2025,Pay in 90 days
O172277,C0187,Customer 187,P0623,16,2025-10-21,25/10/2025,Inform customer once order is sent
O172278,C0909,Customer 909,P0327,17,10-22-2025,31/10/2025,
O172279,C0486,Customer 486,P0505,6,20/10/2025,26/10/2025,Pay in 90 days
O172280,C0138,Customer 138,P0058,6,02/10/2025,11/10/2025,
O172281,C0843,Customer 843,P0863,4,02/10/2025,10/10/2025,
O172282,C0473,Customer 473,P0528,2,21/10/2025,29/10/2025,Inform customer once order is sent
O172283,C0221,Customer 221,P0768,19,10-13-2025,2025-10-17,Inform customer once order is sent
O172284,C0769,Customer 769,P0203,11,10-02-2025,2025-10-10,
O172285,C0414,Customer 414,P0653,10,2025-10-10,12/10/2025,Inform customer once order is sent
O172286,C0694,Customer 694,P0279,19,2025-10-02,2025-10-06,Inform customer once order is sent
O172287,C0440,Customer 440,P0512,13,08/10/2025,2025-10-13,
O172288,C0249,Customer 249,P0550,12,2025-10-18,10-24-2025,
O172289,C0522,Customer 522,P0847,5,01/10/2025,10-11-2025,
O172290,C0592,Customer 592,P0803,13,2025-10-28,2025-10-31,
O172291,C0216,Customer 216,P0031,11,10-12-2025,2025-10-16,Pay in 90 days
O172292,C0984,Customer 984,P0641,10,2025-10-19,10-20-2025,
O172293,C0944,Customer 944,P0139,10,18/10/2025,10-22-2025,Inform customer once order is sent
O172294,C0645,Customer 645,P0589,2,21/10/2025,10-24-2025,
O172295,C0020,Customer 20,P0210,5,10/10/2025,10-16-2025,Pay in 90 days
O172296,C0752,Customer 752,P0629,14,28/10/2025,2025-11-05,Inform customer once order is sent
O172297,C0513,Customer 513,P0767,6,10-11-2025,10-13-2025,
O172298,C0772,Customer 772,P0638,5,10-28-2025,11-04-2025,
O172299,C0789,Customer 789,P0230,11,2025-10-09,17/10/2025,
O172300,C0456,Customer 456,P0106,2,10-16-2025,18/10/2025,Inform customer once order is sent
O172301,C0568,Customer 568,P0755,1,25/10/2025,02/11/2025,
O172302,C0873,Customer 873,P0205,16,2025-10-24,10-28-2025,
O172303,C0253,Customer 253,P0557,11,10-04-2025,07/10/2025,
O172304,C0027,Customer 27,P0286,8,2025-10-19,10-24-2025,
O172305,C0426,Customer 426,P0869,5,2025-10-10,2025-10-19,
O172306,C0574,Customer 574,P0411,8,10-13-2025,2025-10-19,Pay in 90 days
O172307,C0580,Customer 580,P0521,3,2025-10-15,24/10/2025,Pay in 90 days
O172308,C0624,Customer 624,P0296,18,10-26-2025,10-27-2025,
O172309,C0916,Customer 916,P0279,14,10-09-2025,10-10-2025,
O172310,C0723,Customer 723,P0010,4,10-10-2025,10-18-2025,Pay in 90 days
O172311,C0507,Customer 507,P0110,1,22/10/2025,2025-10-27,
O172312,C0058,Customer 58,P0147,8,10-22-2025,01/11/2025,Inform customer once order is sent
O172313,C0866,Customer 866,P0316,8,2025-10-23,2025-10-28,Pay in 90 days
O172314,C0005,Customer 5,P0468,5,10-15-2025,10-16-2025,Inform customer once order is sent
O172315,C0522,Customer 522,P0783,14,03/10/2025,2025-10-04,Inform customer once order is sent
O172316,C0521,Customer 521,P0019,11,03/10/2025,2025-10-06,
O172317,C0480,Customer 480,P0025,12,10-04-2025,10-08-2025,Pay in 90 days
O172318,C0181,Customer 181,P0754,13,10-27-2025,2025-11-01,Pay in 90 days
O172319,C0864,Customer 864,P0694,18,18/10/2025,2025-10-22,Inform customer once order is sent
O172320,C0975,Customer 975,P0063,2,15/10/2025,22/10/2025,
O172321,C0260,Customer 260,P0545,14,10-02-2025,2025-10-03,Pay in 90 days
O172322,C0551,Customer 551,P0774,11,06/10/2025,10-12-2025,Inform customer once order is sent
O172323,C0176,Customer 176,P0151,15,23/10/2025,27/10/2025,Pay in 90 days
O172324,C0558,Customer 558,P0472,10,10-22-2025,10-28-2025,Inform customer once order is sent
O172325,C0319,Customer 319,P0481,16,23/10/2025,10-27-2025,Pay in 90 days
O172326,C0878,Customer 878,P0066,17,10-03-2025,11/10/2025,
O172327,C0236,Customer 236,P0495,19,10-17-2025,18/10/2025,Inform customer once order is sent
O172328,C0743,Customer 743,P0807,3,12/10/2025,16/10/2025,
O172329,C0892,Customer 892,P0060,20,2025-10-18,10-21-2025,Inform customer once order is sent
O172330,C0667,Customer 667,P0297,16,2025-10-27,10-31-2025,
O172331,C0778,Customer 778,P0140,6,26/10/2025,11-01-2025,Inform customer once order is sent
O172332,C0200,Customer 200,P0799,1,10-22-2025,2025-10-23,
O172333,C0155,Customer 155,P0476,9,2025-10-15,2025-10-24,Pay in 90 days
O172334,C0883,Customer 883,P0734,18,17/10/2025,10-21-2025,
O172335,C0312,Customer 312,P0463,2,2025-10-10,10-11-2025,Pay in 90 days
O172336,C0438,Customer 438,P0375,20,10-09-2025,10-11-2025,Inform customer once order is sent
O172337,C0464,Customer 464,P0391,6,10-25-2025,04/11/2025,Pay in 90 days
O172338,C0570,Customer 570,P0704,5,09/10/2025,2025-10-16,
O172339,C0179,Customer 179,P0162,5,10-16-2025,25/10/2025,Inform customer once order is sent
O172340,C0538,Customer 538,P0293,11,08/10/2025,10-13-2025,
O172341,C0177,Customer 177,P0321,4,2025-10-18,2025-10-21,Pay in 90 days
O172342,C0309,Customer 309,P0024,20,10-10-2025,2025-10-13,Pay in 90 days
O172343,C0037,Customer 37,P0729,9,2025-10-20,10-24-2025,Pay in 90 days
O172344,C0562,Customer 562,P0076,9,2025-10-05,2025-10-14,
O172345,C0051,Customer 51,P0800,18,10-04-2025,10-07-2025,Inform customer once order is sent
O172346,C0414,Customer 414,P0236,20,10-23-2025,02/11/2025,
O172347,C0313,Customer 313,P0551,9,05/10/2025,2025-10-09,Inform customer once order is sent
O172348,C0336,Customer 336,P0637,14,10-05-2025,2025-10-06,Inform customer once order is sent
O172349,C0431,Customer 431,P0613,1,10-08-2025,17/10/2025,Pay in 90 days
O172350,C0811,Customer 811,P0229,18,2025-10-21,10-27-2025,Inform customer once order is sent
O172351,C0206,Customer 206,P0232,11,2025-10-25,10-30-2025,
O172352,C0766,Customer 766,P0516,20,19/10/2025,23/10/2025,Pay in 90 days
O172353,C0688,Customer 688,P0017,13,01/10/2025,10-11-2025,Inform customer once order is sent
O172354,C0884,Customer 884,P0134,16,2025-10-15,23/10/2025,
O172355,C0303,Customer 303,P0711,16,2025-10-21,25/10/2025,
O172356,C0831,Customer 831,P0729,16,2025-10-16,10-24-2025,Pay in 90 days
O172357,C0748,Customer 748,P0739,20,2025-10-24,10-26-2025,Pay in 90 days
O172358,C0712,Customer 712,P0408,16,26/10/2025,10-29-2025,
O172359,C0934,Customer 934,P0472,8,2025-10-20,10-27-2025,
O172360,C0470,Customer 470,P0049,9,2025-10-27,11-06-2025,Pay in 90 days
O172361,C0961,Customer 961,P0144,16,09/10/2025,12/10/2025,Pay in 90 days
O172362,C0563,Customer 563,P0329,4,2025-10-11,10-21-2025,Pay in 90 days
O172363,C0222,Customer 222,P0699,10,2025-10-14,10-21-2025,
O172364,C0367,Customer 367,P0590,17,09/10/2025,10-13-2025,Pay in 90 days
O172365,C0395,Customer 395,P0110,19,10-03-2025,10-11-2025,Inform customer once order is sent
O172366,C0159,Customer 159,P0649,15,2025-10-22,11-01-2025,Pay in 90 days
O172367,C0850,Customer 850,P0516,16,2025-10-02,2025-10-08,
O172368,C0579,Customer 579,P0826,20,10-22-2025,10-31-2025,Pay in 90 days
O172369,C0304,Customer 304,P0407,7,10-10-2025,17/10/2025,Pay in 90 days
O172370,C0919,Customer 919,P0766,19,10-19-2025,25/10/2025,
O172371,C0899,Customer 899,P0098,13,09/10/2025,10-17-2025,Pay in 90 days
O172372,C0906,Customer 906,P0842,5,2025-10-06,2025-10-16,
O172373,C0955,Customer 955,P0002,2,13/10/2025,10-14-2025,
O172374,C0949,Customer 949,P0193,19,2025-10-04,11/10/2025,Inform customer once order is sent
O172375,C0334,Customer 334,P0434,9,2025-10-24,2025-10-28,Inform customer once order is sent
O172376,C0564,Customer 564,P0355,15,10-12-2025,10-18-2025,
O172377,C0441,Customer 441,P0421,9,06/10/2025,10-16-2025,Pay in 90 days
O172378,C0595,Customer 595,P0192,11,10-03-2025,11/10/2025,Inform customer once order is sent
O172379,C0561,Customer 561,P0658,19,2025-10-28,2025-11-01,Inform customer once order is sent
O172380,C0478,Customer 478,P0093,1,01/10/2025,06/10/2025,Inform customer once order is sent
O172381,C0420,Customer 420,P0029,6,14/10/2025,17/10/2025,Pay in 90 days
O172382,C0649,Customer 649,P0445,17,2025-10-13,2025-10-21,
O172383,C0068,Customer 68,P0611,9,03/10/2025,04/10/2025,
O172384,C0175,Customer 175,P0760,16,2025-10-15,2025-10-20,Pay in 90 days
O172385,C0206,Customer 206,P0005,14,04/10/2025,10-13-2025,Inform customer once order is sent
O172386,C0510,Customer 510,P0690,10,2025-10-18,2025-10-28,Pay in 90 days
O172387,C0054,Customer 54,P0681,9,2025-10-06,15/10/2025,Pay in 90 days
O172388,C0953,Customer 953,P0881,20,2025-10-14,22/10/2025,Inform customer once order is sent
O172389,C0448,Customer 448,P0878,9,08/10/2025,10-18-2025,
O172390,C0202,Customer 202,P0539,5,10-02-2025,06/10/2025,Inform customer once order is sent
O172391,C0060,Customer 60,P0034,16,15/10/2025,2025-10-21,Inform customer once order is sent
O172392,C0236,Customer 236,P0581,17,2025-10-02,10-12-2025,
O172393,C0938,Customer 938,P0146,16,2025-10-14,2025-10-20,Inform customer once order is sent
O172394,C0266,Customer 266,P0287,15,10-22-2025,2025-10-29,Inform customer once order is sent
O172395,C0073,Customer 73,P0478,9,10-24-2025,2025-10-31,
O172396,C0862,Customer 862,P0506,2,2025-10-06,2025-10-09,Inform customer once order is sent
O172397,C0537,Customer 537,P0563,3,06/10/2025,2025-10-16,Inform customer once order is sent
O172398,C0921,Customer 921,P0535,10,2025-10-13,10-15-2025,Pay in 90 days
O172399,C0420,Customer 420,P0834,8,2025-10-12,10-19-2025,Pay in 90 days
O172400,C0356,Customer 356,P0817,17,11/10/2025,10-15-2025,Inform customer once order is sent
O172401,C0599,Customer 599,P0092,17,10-24-2025,10-30-2025,
O172402,C0648,Customer 648,P0357,9,2025-10-03,2025-10-12,
O172403,C0080,Customer 80,P0837,15,10-17-2025,2025-10-19,Inform customer once order is sent
O172404,C0013,Customer 13,P0203,12,2025-10-19,27/10/2025,
O172405,C0098,Customer 98,P0738,15,10-10-2025,2025-10-16,Pay in 90 days
O172406,C0522,Customer 522,P0539,10,2025-10-19,2025-10-22,Inform customer once order is sent
O172407,C0412,Customer 412,P0387,1,10-06-2025,2025-10-14,Pay in 90 days
O172408,C0207,Customer 207,P0044,17,2025-10-02,10-05-2025,Pay in 90 days
O172409,C0326,Customer 326,P0305,19,10-25-2025,10-29-2025,
O172410,C0171,Customer 171,P0155,6,2025-10-13,10-17-2025,Pay in 90 days
O172411,C0337,Customer 337,P0164,8,08/10/2025,10-16-2025,Inform customer once order is sent
O172412,C0098,Customer 98,P0132,20,2025-10-01,03/10/2025,
O172413,C0675,Customer 675,P0735,17,20/10/2025,10-28-2025,Inform customer once order is sent
O172414,C0793,Customer 793,P0852,13,10-06-2025,2025-10-10,
O172415,C0903,Customer 903,P0339,16,20/10/2025,28/10/2025,Inform customer once order is sent
O172416,C0637,Customer 637,P0364,17,28/10/2025,10-31-2025,Inform customer once order is sent
O172417,C0877,Customer 877,P0208,16,15/10/2025,21/10/2025,Inform customer once order is sent
O172418,C0579,Customer 579,P0428,8,2025-10-08,10-15-2025,Inform customer once order is sent
O172419,C0793,Customer 793,P0107,19,10-05-2025,09/10/2025,Pay in 90 days
O172420,C0792,Customer 792,P0338,11,10/10/2025,10-12-2025,Pay in 90 days
O172421,C0089,Customer 89,P0269,4,10-14-2025,2025-10-22,
O172422,C0578,Customer 578,P0197,10,03/10/2025,10-11-2025,
O172423,C0878,Customer 878,P0003,4,27/10/2025,06/11/2025,Pay in 90 days
O172424,C0172,Customer 172,P0429,6,2025-10-10,10-20-2025,Inform customer once order is sent
O172425,C0432,Customer 432,P0796,1,2025-10-01,06/10/2025,
O172426,C0904,Customer 904,P0838,12,03/10/2025,10-13-2025,Inform customer once order is sent
O172427,C0901,Customer 901,P0729,11,2025-10-24,10-25-2025,Pay in 90 days
O172428,C0001,Customer 1,P0477,5,2025-10-20,2025-10-22,
O172429,C0423,Customer 423,P0553,20,28/10/2025,2025-11-07,Inform customer once order is sent
O172430,C0774,Customer 774,P0442,19,19/10/2025,22/10/2025,Pay in 90 days
O172431,C0406,Customer 406,P0821,17,10-13-2025,2025-10-18,Pay in 90 days
O172432,C0078,Customer 78,P0872,20,10-01-2025,04/10/2025,Inform customer once order is sent
O172433,C0693,Customer 693,P0252,9,2025-10-13,23/10/2025,Inform customer once order is sent
O172434,C0420,Customer 420,P0633,5,2025-10-15,2025-10-25,Pay in 90 days
O172435,C0558,Customer 558,P0525,13,10/10/2025,10-17-2025,
O172436,C0293,Customer 293,P0402,20,10-02-2025,2025-10-07,Pay in 90 days
O172437,C0946,Customer 946,P0696,14,2025-10-05,07/10/2025,
O172438,C0413,Customer 413,P0402,4,2025-10-18,10-24-2025,Pay in 90 days
O172439,C0356,Customer 356,P0345,7,10-26-2025,10-27-2025,Inform customer once order is sent
O172440,C0962,Customer 962,P0686,8,01/10/2025,10-07-2025,Inform customer once order is sent
O172441,C0600,Customer 600,P0318,8,10-23-2025,27/10/2025,
O172442,C0099,Customer 99,P0482,17,21/10/2025,10-29-2025,
O172443,C0363,Customer 363,P0236,14,10-21-2025,22/10/2025,
O172444,C0217,Customer 217,P0717,7,10-15-2025,10-25-2025,Inform customer once order is sent
O172445,C0532,Customer 532,P0136,6,2025-10-16,2025-10-17,
O172446,C0076,Customer 76,P0335,20,10-16-2025,2025-10-21,Inform customer once order is sent
O172447,C0001,Customer 1,P0344,7,2025-10-09,18/10/2025,
O172448,C0020,Customer 20,P0729,4,21/10/2025,10-22-2025,
O172449,C0155,Customer 155,P0483,18,01/10/2025,04/10/2025,Inform customer once order is sent
O172450,C0852,Customer 852,P0374,1,10/10/2025,2025-10-13,Pay in 90 days
O172451,C0763,Customer 763,P0116,11,10-02-2025,09/10/2025,Pay in 90 days
O172452,C0211,Customer 211,P0500,8,01/10/2025,2025-10-02,Pay in 90 days
O172453,C0956,Customer 956,P0860,15,24/10/2025,2025-10-29,Inform customer once order is sent
O172454,C0865,Customer 865,P0102,16,10-18-2025,10-25-2025,Inform customer once order is sent
O172455,C0819,Customer 819,P0667,19,2025-10-19,2025-10-29,
O172456,C0994,Customer 994,P0447,2,2025-10-08,10-17-2025,Pay in 90 days
O172457,C0850,Customer 850,P0650,12,10-18-2025,22/10/2025,Inform customer once order is sent
O172458,C0787,Customer 787,P0367,17,2025-10-26,28/10/2025,Inform customer once order is sent
O172459,C0965,Customer 965,P0657,6,10-11-2025,16/10/2025,Inform customer once order is sent
O172460,C0258,Customer 258,P0371,9,10-04-2025,10-12-2025,Pay in 90 days
O172461,C0705,Customer 705,P0559,7,20/10/2025,2025-10-30,
O172462,C0599,Customer 599,P0825,13,22/10/2025,10-23-2025,
O172463,C0918,Customer 918,P0009,3,22/10/2025,01/11/2025,
O172464,C0047,Customer 47,P0586,16,10-28-2025,01/11/2025,
O172465,C0204,Customer 204,P0236,19,2025-10-14,10-24-2025,Pay in 90 days
O172466,C0711,Customer 711,P0059,17,10-11-2025,13/10/2025,Pay in 90 days
O172467,C0629,Customer 629,P0166,2,06/10/2025,10-16-2025,
O172468,C0934,Customer 934,P0847,12,24/10/2025,29/10/2025,
O172469,C0528,Customer 528,P0127,9,2025-10-26,11-03-2025,Inform customer once order is sent
O172470,C0357,Customer 357,P0388,19,10-20-2025,26/10/2025,Inform customer once order is sent
O172471,C0598,Customer 598,P0830,7,26/10/2025,11-01-2025,Pay in 90 days
O172472,C0316,Customer 316,P0101,20,19/10/2025,21/10/2025,Inform customer once order is sent
O172473,C0358,Customer 358,P0107,18,10/10/2025,10-15-2025,Pay in 90 days
O172474,C0413,Customer 413,P0270,17,10-17-2025,2025-10-19,Inform customer once order is sent
O172475,C0723,Customer 723,P0136,1,16/10/2025,10-26-2025,Pay in 90 days
O172476,C0434,Customer 434,P0125,14,2025-10-07,10-17-2025,Inform customer once order is sent
O172477,C0067,Customer 67,P0538,6,10-17-2025,25/10/2025,
O172478,C0466,Customer 466,P0120,7,26/10/2025,11-02-2025,Pay in 90 days
O172479,C0422,Customer 422,P0553,8,10-02-2025,10-11-2025,Inform customer once order is sent
O172480,C0319,Customer 319,P0344,2,10-14-2025,16/10/2025,Inform customer once order is sent
O172481,C0378,Customer 378,P0480,7,2025-10-21,10-22-2025,Inform customer once order is sent
O172482,C0055,Customer 55,P0260,2,10-08-2025,10-16-2025,Inform customer once order is sent
O172483,C0112,Customer 112,P0072,20,10-11-2025,12/10/2025,Pay in 90 days
O172484,C0327,Customer 327,P0805,9,26/10/2025,03/11/2025,
O172485,C0300,Customer 300,P0069,2,2025-10-27,11-05-2025,Inform customer once order is sent
O172486,C0661,Customer 661,P0431,4,10-24-2025,11-03-2025,
O172487,C0062,Customer 62,P0835,20,10-20-2025,25/10/2025,
O172488,C0553,Customer 553,P0165,6,10-18-2025,10-21-2025,Inform customer once order is sent
O172489,C0795,Customer 795,P0801,9,10-03-2025,07/10/2025,Pay in 90 days
O172490,C0729,Customer 729,P0148,16,19/10/2025,2025-10-20,Pay in 90 days
O172491,C0054,Customer 54,P0362,16,19/10/2025,26/10/2025,Pay in 90 days
O172492,C0978,Customer 978,P0865,8,14/10/2025,10-19-2025,Pay in 90 days
O172493,C0114,Customer 114,P0411,4,10-16-2025,10-26-2025,
O172494,C0683,Customer 683,P0254,6,10-21-2025,2025-10-26,Pay in 90 days
O172495,C0734,Customer 734,P0869,16,06/10/2025,11/10/2025,
O172496,C0607,Customer 607,P0518,16,10-11-2025,10-12-2025,
O172497,C0662,Customer 662,P0746,4,22/10/2025,10-24-2025,Inform customer once order is sent
O172498,C0050,Customer 50,P0017,1,10-11-2025,21/10/2025,
O172499,C0603,Customer 603,P0492,17,27/10/2025,2025-10-31,Pay in 90 days
O172500,C0020,Customer 20,P0566,11,10-28-2025,10-30-2025,Inform customer once order is sent
O172501,C0694,Customer 694,P0359,14,2025-10-09,13/10/2025,Inform customer once order is sent
O172502,C0176,Customer 176,P0722,13,10-05-2025,2025-10-09,
O172503,C0195,Customer 195,P0594,18,2025-10-27,2025-11-05,Pay in 90 days
O172504,C0712,Customer 712,P0084,15,10-20-2025,2025-10-21,
O172505,C0898,Customer 898,P0559,3,05/10/2025,2025-10-09,Inform customer once order is sent
O172506,C0877,Customer 877,P0362,7,05/10/2025,10-09-2025,Pay in 90 days
O172507,C0722,Customer 722,P0734,9,10-17-2025,10-20-2025,
O172508,C0928,Customer 928,P0723,16,10-26-2025,2025-10-27,
O172509,C0603,Customer 603,P0331,19,10-12-2025,10-21-2025,Inform customer once order is sent
O172510,C0387,Customer 387,P0810,17,2025-10-20,10-30-2025,Pay in 90 days
O172511,C0493,Customer 493,P0408,15,2025-10-16,23/10/2025,Pay in 90 days
O172512,C0061,Customer 61,P0489,10,10-05-2025,13/10/2025,
O172513,C0283,Customer 283,P0794,12,10-28-2025,05/11/2025,
O172514,C0011,Customer 11,P0304,20,2025-10-02,07/10/2025,Inform customer once order is sent
O172515,C0637,Customer 637,P0469,9,10-12-2025,21/10/2025,Pay in 90 days
O172516,C0151,Customer 151,P0347,20,10-18-2025,27/10/2025,Inform customer once order is sent
O172517,C0609,Customer 609,P0313,15,10-06-2025,12/10/2025,Pay in 90 days
O172518,C0769,Customer 769,P0419,15,10-03-2025,10-13-2025,Inform customer once order is sent
O172519,C0298,Customer 298,P0153,2,2025-10-03,10-13-2025,Inform customer once order is sent
O172520,C0145,Customer 145,P0302,4,10-07-2025,10-09-2025,Inform customer once order is sent
O172521,C0992,Customer 992,P0190,1,13/10/2025,16/10/2025,Inform customer once order is sent
O172522,C0456,Customer 456,P0059,3,25/10/2025,02/11/2025,
O172523,C0598,Customer 598,P0660,10,13/10/2025,21/10/2025,
O172524,C0853,Customer 853,P0890,20,10-24-2025,10-25-2025,Pay in 90 days
O172525,C0369,Customer 369,P0751,10,08/10/2025,2025-10-17,Pay in 90 days
O172526,C0819,Customer 819,P0308,20,10-13-2025,22/10/2025,Pay in 90 days
O172527,C0854,Customer 854,P0126,19,2025-10-25,11-02-2025,Pay in 90 days
O172528,C0439,Customer 439,P0559,17,10-07-2025,2025-10-12,
O172529,C0054,Customer 54,P0757,8,17/10/2025,10-21-2025,Pay in 90 days
O172530,C0616,Customer 616,P0433,20,10-03-2025,10-06-2025,Pay in 90 days
O172531,C0571,Customer 571,P0225,13,2025-10-12,2025-10-17,Inform customer once order is sent
O172532,C0054,Customer 54,P0213,18,10-15-2025,2025-10-22,Pay in 90 days
O172533,C0753,Customer 753,P0254,10,10-17-2025,18/10/2025,Pay in 90 days
O172534,C0751,Customer 751,P0188,16,2025-10-08,09/10/2025,Inform customer once order is sent
O172535,C0238,Customer 238,P0394,16,2025-10-07,09/10/2025,Pay in 90 days
O172536,C0680,Customer 680,P0517,1,10-04-2025,2025-10-10,Pay in 90 days
O172537,C0576,Customer 576,P0888,15,2025-10-26,27/10/2025,Pay in 90 days
O172538,C0805,Customer 805,P0547,17,16/10/2025,2025-10-20,Pay in 90 days
O172539,C0385,Customer 385,P0534,8,10-10-2025,17/10/2025,
O172540,C0245,Customer 245,P0343,14,2025-10-13,19/10/2025,Pay in 90 days
O172541,C0535,Customer 535,P0139,13,21/10/2025,27/10/2025,
O172542,C0379,Customer 379,P0044,9,10-25-2025,27/10/2025,
O172543,C0198,Customer 198,P0280,5,2025-10-26,29/10/2025,
O172544,C0355,Customer 355,P0857,9,10-22-2025,27/10/2025,
O172545,C0988,Customer 988,P0249,11,2025-10-06,13/10/2025,
O172546,C0769,Customer 769,P0382,18,2025-10-16,10-18-2025,Pay in 90 days
O172547,C0345,Customer 345,P0277,7,2025-10-05,2025-10-15,
O172548,C0880,Customer 880,P0610,3,15/10/2025,2025-10-16,Pay in 90 days
O172549,C0025,Customer 25,P0780,17,2025-10-17,22/10/2025,
O172550,C0781,Customer 781,P0867,2,10-16-2025,10-19-2025,
O172551,C0778,Customer 778,P0895,12,10-19-2025,10-28-2025,Pay in 90 days
O172552,C0227,Customer 227,P0465,15,14/10/2025,10-23-2025,
O172553,C0250,Customer 250,P0083,13,10-16-2025,2025-10-24,
O172554,C0500,Customer 500,P0613,6,2025-10-22,30/10/2025,
O172555,C0536,Customer 536,P0532,17,10-05-2025,07/10/2025,Inform customer once order is sent
O172556,C0002,Customer 2,P0879,19,15/10/2025,2025-10-17,
O172557,C0448,Customer 448,P0515,13,10-14-2025,2025-10-17,Inform customer once order is sent
O172558,C0024,Customer 24,P0680,14,05/10/2025,11/10/2025,
O172559,C0132,Customer 132,P0819,16,21/10/2025,2025-10-30,Pay in 90 days
O172560,C0237,Customer 237,P0495,4,12/10/2025,2025-10-13,
O172561,C0102,Customer 102,P0464,13,18/10/2025,2025-10-27,
O172562,C0305,Customer 305,P0730,7,10-04-2025,14/10/2025,Inform customer once order is sent
O172563,C0227,Customer 227,P0129,18,2025-10-18,2025-10-27,Pay in 90 days
O172564,C0499,Customer 499,P0397,20,10-19-2025,2025-10-24,Pay in 90 days
O172565,C0108,Customer 108,P0794,15,14/10/2025,2025-10-18,Inform customer once order is sent
O172566,C0054,Customer 54,P0532,3,10-04-2025,10-13-2025,
O172567,C0162,Customer 162,P0528,17,2025-10-12,2025-10-18,Inform customer once order is sent
O172568,C0225,Customer 225,P0159,3,2025-10-24,31/10/2025,
O172569,C0178,Customer 178,P0225,16,18/10/2025,22/10/2025,Pay in 90 days
O172570,C0104,Customer 104,P0509,3,2025-10-16,10-19-2025,Inform customer once order is sent
O172571,C0577,Customer 577,P0719,8,19/10/2025,2025-10-22,Pay in 90 days
O172572,C0497,Customer 497,P0113,10,2025-10-24,29/10/2025,
O172573,C0997,Customer 997,P0678,9,20/10/2025,10-25-2025,
O172574,C0645,Customer 645,P0588,8,06/10/2025,2025-10-10,Pay in 90 days
O172575,C0880,Customer 880,P0775,19,10-03-2025,10-08-2025,
O172576,C0771,Customer 771,P0896,7,06/10/2025,2025-10-15,Pay in 90 days
O172577,C0950,Customer 950,P0629,15,2025-10-14,10-17-2025,
O172578,C0620,Customer 620,P0027,10,27/10/2025,10-29-2025,Pay in 90 days
O172579,C0241,Customer 241,P0389,12,2025-10-25,02/11/2025,Inform customer once order is sent
O172580,C0826,Customer 826,P0390,12,2025-10-27,2025-10-29,Inform customer once order is sent
O172581,C0878,Customer 878,P0010,2,10-19-2025,22/10/2025,Pay in 90 days
O172582,C0538,Customer 538,P0144,16,23/10/2025,24/10/2025,Pay in 90 days
O172583,C0026,Customer 26,P0426,12,10-21-2025,25/10/2025,Inform customer once order is sent
O172584,C0064,Customer 64,P0430,5,2025-10-05,08/10/2025,Pay in 90 days
O172585,C0485,Customer 485,P0535,1,08/10/2025,2025-10-12,Inform customer once order is sent
O172586,C0711,Customer 711,P0319,18,10-25-2025,10-29-2025,
O172587,C0702,Customer 702,P0494,8,23/10/2025,25/10/2025,Pay in 90 days
O172588,C0272,Customer 272,P0517,17,2025-10-10,2025-10-13,
O172589,C0381,Customer 381,P0707,10,2025-10-16,2025-10-22,Inform customer once order is sent
O172590,C0301,Customer 301,P0730,8,10-10-2025,2025-10-12,Inform customer once order is sent
O172591,C0516,Customer 516,P0811,18,2025-10-01,05/10/2025,Pay in 90 days
O172592,C0899,Customer 899,P0467,19,2025-10-15,10-25-2025,Pay in 90 days
O172593,C0967,Customer 967,P0823,14,10-24-2025,2025-10-29,
O172594,C0944,Customer 944,P0471,1,10-05-2025,10-15-2025,
O172595,C0944,Customer 944,P0667,13,10/10/2025,10-20-2025,Pay in 90 days
O172596,C0302,Customer 302,P0044,16,21/10/2025,10-22-2025,Inform customer once order is sent
O172597,C0731,Customer 731,P0869,4,2025-10-19,10-22-2025,Pay in 90 days
O172598,C0185,Customer 185,P0540,16,10-11-2025,16/10/2025,Pay in 90 days
O172599,C0933,Customer 933,P0694,13,10-06-2025,15/10/2025,Inform customer once order is sent
O172600,C0182,Customer 182,P0852,19,10-12-2025,19/10/2025,
O172601,C0400,Customer 400,P0030,5,09/10/2025,2025-10-17,Inform customer once order is sent
O172602,C0175,Customer 175,P0028,14,10-04-2025,10-07-2025,
O172603,C0746,Customer 746,P0294,18,10-23-2025,2025-10-31,Pay in 90 days
O172604,C0212,Customer 212,P0281,1,2025-10-01,07/10/2025,Inform customer once order is sent
O172605,C0964,Customer 964,P0237,10,24/10/2025,11-02-2025,Pay in 90 days
O172606,C0647,Customer 647,P0788,12,2025-10-18,2025-10-28,Pay in 90 days
O172607,C0312,Customer 312,P0292,6,10-09-2025,10-11-2025,Pay in 90 days
O172608,C0613,Customer 613,P0427,7,10-10-2025,2025-10-19,Pay in 90 days
O172609,C0925,Customer 925,P0888,10,10-19-2025,2025-10-22,Inform customer once order is sent
O172610,C0251,Customer 251,P0614,10,08/10/2025,10/10/2025,Pay in 90 days
O172611,C0716,Customer 716,P0239,5,10/10/2025,14/10/2025,Inform customer once order is sent
O172612,C0293,Customer 293,P0576,6,2025-10-15,10-17-2025,Inform customer once order is sent
O172613,C0328,Customer 328,P0028,2,24/10/2025,10-29-2025,Pay in 90 days
O172614,C0900,Customer 900,P0264,16,24/10/2025,2025-10-26,
O172615,C0243,Customer 243,P0079,19,2025-10-03,10-08-2025,Inform customer once order is sent
O172616,C0996,Customer 996,P0672,12,28/10/2025,2025-11-03,
O172617,C0637,Customer 637,P0185,3,2025-10-27,10-28-2025,Pay in 90 days
O172618,C0895,Customer 895,P0652,10,10-25-2025,2025-10-26,
O172619,C0548,Customer 548,P0900,13,2025-10-21,31/10/2025,Inform customer once order is sent
O172620,C0965,Customer 965,P0811,18,27/10/2025,11-03-2025,Pay in 90 days
O172621,C0368,Customer 368,P0129,4,2025-10-26,27/10/2025,
O172622,C0822,Customer 822,P0703,1,25/10/2025,2025-10-26,Pay in 90 days
O172623,C0082,Customer 82,P0897,4,2025-10-07,17/10/2025,Inform customer once order is sent
O172624,C0905,Customer 905,P0178,7,10-19-2025,27/10/2025,
O172625,C0139,Customer 139,P0489,4,10-12-2025,20/10/2025,Pay in 90 days
O172626,C0448,Customer 448,P0728,13,10-18-2025,22/10/2025,
O172627,C0519,Customer 519,P0821,13,2025-10-09,2025-10-11,
O172628,C0481,Customer 481,P0114,4,10-12-2025,17/10/2025,Inform customer once order is sent
O172629,C0349,Customer 349,P0197,11,05/10/2025,13/10/2025,
O172630,C0454,Customer 454,P0801,20,10-17-2025,2025-10-24,
O172631,C0325,Customer 325,P0504,15,27/10/2025,06/11/2025,Pay in 90 days
O172632,C0271,Customer 271,P0206,10,10-24-2025,26/10/2025,Inform customer once order is sent
O172633,C0728,Customer 728,P0363,12,27/10/2025,2025-11-06,Inform customer once order is sent
O172634,C0373,Customer 373,P0602,11,10-07-2025,10-08-2025,Inform customer once order is sent
O172635,C0182,Customer 182,P0770,12,10-23-2025,01/11/2025,Pay in 90 days
O172636,C0043,Customer 43,P0603,9,10-08-2025,10-11-2025,Pay in 90 days
O172637,C0894,Customer 894,P0629,7,10-21-2025,2025-10-25,
O172638,C0921,Customer 921,P0463,7,10-09-2025,10-14-2025,Pay in 90 days
O172639,C0134,Customer 134,P0560,3,24/10/2025,27/10/2025,Pay in 90 days
O172640,C0883,Customer 883,P0395,1,2025-10-08,10-11-2025,Inform customer once order is sent
O172641,C0669,Customer 669,P0845,7,2025-10-10,16/10/2025,Pay in 90 days
O172642,C0288,Customer 288,P0884,13,2025-10-05,09/10/2025,Pay in 90 days
O172643,C0508,Customer 508,P0553,6,08/10/2025,09/10/2025,
O172644,C0842,Customer 842,P0873,16,20/10/2025,30/10/2025,
O172645,C0303,Customer 303,P0703,9,2025-10-07,10/10/2025,Pay in 90 days
O172646,C0892,Customer 892,P0513,10,13/10/2025,10-21-2025,
O172647,C0984,Customer 984,P0181,9,2025-10-07,16/10/2025,Pay in 90 days
O172648,C0554,Customer 554,P0340,18,10-08-2025,2025-10-13,Pay in 90 days
O172649,C0157,Customer 157,P0637,12,26/10/2025,2025-10-29,Inform customer once order is sent
O172650,C0685,Customer 685,P0382,20,2025-10-15,2025-10-25,Inform customer once order is sent
O172651,C0394,Customer 394,P0274,16,03/10/2025,04/10/2025,Pay in 90 days
O172652,C0610,Customer 610,P0192,11,10-16-2025,10-24-2025,Inform customer once order is sent
O172653,C0086,Customer 86,P0861,8,2025-10-28,11-01-2025,Inform customer once order is sent
O172654,C0001,Customer 1,P0361,20,2025-10-26,27/10/2025,Pay in 90 days
O172655,C0604,Customer 604,P0490,20,11/10/2025,2025-10-17,Inform customer once order is sent
O172656,C0701,Customer 701,P0413,6,10/10/2025,10-16-2025,Inform customer once order is sent
O172657,C0551,Customer 551,P0041,8,19/10/2025,2025-10-29,Inform customer once order is sent
O172658,C0793,Customer 793,P0671,8,10-07-2025,10-11-2025,
O172659,C0808,Customer 808,P0069,8,11/10/2025,10-16-2025,
O172660,C0946,Customer 946,P0103,9,22/10/2025,11-01-2025,Inform customer once order is sent
O172661,C0937,Customer 937,P0767,2,10-21-2025,10-22-2025,Inform customer once order is sent
O172662,C0317,Customer 317,P0301,18,10-13-2025,20/10/2025,Inform customer once order is sent
O172663,C0945,Customer 945,P0705,14,2025-10-25,04/11/2025,Pay in 90 days
O172664,C0707,Customer 707,P0562,2,10-20-2025,2025-10-29,Pay in 90 days
O172665,C0296,Customer 296,P0539,10,10-19-2025,10-22-2025,
O172666,C0703,Customer 703,P0096,10,2025-10-13,17/10/2025,
O172667,C0322,Customer 322,P0794,5,09/10/2025,10-19-2025,Pay in 90 days
O172668,C0650,Customer 650,P0593,16,2025-10-24,28/10/2025,Pay in 90 days
O172669,C0291,Customer 291,P0182,17,2025-10-23,10-24-2025,Inform customer once order is sent
O172670,C0493,Customer 493,P0201,14,16/10/2025,2025-10-19,Inform customer once order is sent
O172671,C0712,Customer 712,P0682,2,2025-10-22,2025-10-24,Pay in 90 days
O172672,C0409,Customer 409,P0207,11,18/10/2025,28/10/2025,Inform customer once order is sent
O172673,C0023,Customer 23,P0513,7,2025-10-09,10-17-2025,Pay in 90 days
O172674,C0951,Customer 951,P0175,18,2025-10-28,2025-11-06,Pay in 90 days
O172675,C0036,Customer 36,P0480,8,2025-10-05,10-08-2025,Inform customer once order is sent
O172676,C0010,Customer 10,P0310,6,10-08-2025,2025-10-17,Inform customer once order is sent
O172677,C0078,Customer 78,P0633,16,2025-10-04,05/10/2025,Pay in 90 days
O172678,C0945,Customer 945,P0621,9,14/10/2025,2025-10-18,Pay in 90 days
O172679,C0655,Customer 655,P0652,14,2025-10-17,26/10/2025,Inform customer once order is sent
O172680,C0768,Customer 768,P0497,18,09/10/2025,16/10/2025,Pay in 90 days
O172681,C0402,Customer 402,P0516,15,2025-10-15,10-25-2025,
O172682,C0359,Customer 359,P0652,16,2025-10-02,12/10/2025,Inform customer once order is sent
O172683,C0950,Customer 950,P0786,15,2025-10-21,10-23-2025,Inform customer once order is sent
O172684,C0140,Customer 140,P0243,16,10-12-2025,21/10/2025,
O172685,C0787,Customer 787,P0775,17,10-12-2025,10-20-2025,Inform customer once order is sent
O172686,C0556,Customer 556,P0471,8,05/10/2025,10-10-2025,
O172687,C0452,Customer 452,P0284,13,26/10/2025,2025-11-04,Inform customer once order is sent
O172688,C0396,Customer 396,P0070,15,2025-10-05,10/10/2025,Pay in 90 days
O172689,C0642,Customer 642,P0191,16,24/10/2025,11-01-2025,Pay in 90 days
O172690,C0829,Customer 829,P0057,8,19/10/2025,22/10/2025,Pay in 90 days
O172691,C0812,Customer 812,P0387,9,10-17-2025,10-26-2025,
O172692,C0378,Customer 378,P0019,16,21/10/2025,31/10/2025,Pay in 90 days
O172693,C0047,Customer 47,P0158,2,10-15-2025,20/10/2025,
O172694,C0459,Customer 459,P0831,2,2025-10-26,27/10/2025,Inform customer once order is sent
O172695,C0534,Customer 534,P0063,19,2025-10-25,10-30-2025,
O172696,C0678,Customer 678,P0686,11,10-01-2025,2025-10-04,Pay in 90 days
O172697,C0893,Customer 893,P0596,11,12/10/2025,2025-10-18,
O172698,C0188,Customer 188,P0512,18,2025-10-07,2025-10-09,Pay in 90 days
O172699,C0941,Customer 941,P0866,16,2025-10-16,21/10/2025,Inform customer once order is sent
O172700,C0309,Customer 309,P0595,9,10-08-2025,10-16-2025,Pay in 90 days
O172701,C0347,Customer 347,P0511,10,18/10/2025,10-19-2025,Pay in 90 days
O172702,C0897,Customer 897,P0484,10,2025-10-13,23/10/2025,Inform customer once order is sent
O172703,C0660,Customer 660,P0266,4,10-14-2025,23/10/2025,Pay in 90 days
O172704,C0708,Customer 708,P0727,18,19/10/2025,10-28-2025,Inform customer once order is sent
O172705,C0087,Customer 87,P0120,19,14/10/2025,10-24-2025,
O172706,C0742,Customer 742,P0690,7,2025-10-21,10-31-2025,
O172707,C0782,Customer 782,P0753,10,10-27-2025,29/10/2025,Inform customer once order is sent
O172708,C0826,Customer 826,P0128,17,10-07-2025,10-09-2025,Inform customer once order is sent
O172709,C0079,Customer 79,P0394,19,28/10/2025,2025-10-31,Inform customer once order is sent
O172710,C0394,Customer 394,P0320,9,08/10/2025,2025-10-15,Pay in 90 days
O172711,C0724,Customer 724,P0868,4,10-27-2025,10-30-2025,Inform customer once order is sent
O172712,C0239,Customer 239,P0572,2,10-03-2025,10-11-2025,
O172713,C0451,Customer 451,P0177,4,10-22-2025,10-25-2025,Inform customer once order is sent
O172714,C0120,Customer 120,P0435,10,10-20-2025,10-21-2025,Inform customer once order is sent
O172715,C0819,Customer 819,P0352,11,10-28-2025,11-02-2025,Inform customer once order is sent
O172716,C0998,Customer 998,P0788,16,2025-10-10,2025-10-12,Inform customer once order is sent
O172717,C0546,Customer 546,P0261,19,10-02-2025,07/10/2025,
O172718,C0868,Customer 868,P0516,2,04/10/2025,2025-10-07,Inform customer once order is sent
O172719,C0243,Customer 243,P0261,1,21/10/2025,31/10/2025,
O172720,C0055,Customer 55,P0566,11,08/10/2025,10-09-2025,Pay in 90 days
O172721,C0768,Customer 768,P0511,12,19/10/2025,23/10/2025,Pay in 90 days
O172722,C0136,Customer 136,P0098,2,10-02-2025,04/10/2025,Inform customer once order is sent
O172723,C0961,Customer 961,P0759,10,24/10/2025,30/10/2025,
O172724,C0916,Customer 916,P0015,19,25/10/2025,02/11/2025,Inform customer once order is sent
O172725,C0812,Customer 812,P0540,19,2025-10-10,2025-10-19,
O172726,C0370,Customer 370,P0311,20,20/10/2025,2025-10-26,
O172727,C0816,Customer 816,P0592,7,20/10/2025,10-26-2025,Inform customer once order is sent
O172728,C0446,Customer 446,P0652,7,10-11-2025,12/10/2025,
O172729,C0403,Customer 403,P0587,1,2025-10-23,2025-10-30,
O172730,C0572,Customer 572,P0012,6,10-01-2025,10-10-2025,Pay in 90 days
O172731,C0723,Customer 723,P0635,2,2025-10-21,2025-10-28,Inform customer once order is sent
O172732,C0865,Customer 865,P0738,15,2025-10-03,2025-10-04,
O172733,C0502,Customer 502,P0179,2,10-22-2025,10-29-2025,Inform customer once order is sent
O172734,C0279,Customer 279,P0206,10,22/10/2025,2025-10-29,
O172735,C0721,Customer 721,P0676,1,27/10/2025,01/11/2025,Inform customer once order is sent
O172736,C0639,Customer 639,P0747,18,10/10/2025,17/10/2025,
O172737,C0533,Customer 533,P0169,4,10-05-2025,10-15-2025,
O172738,C0109,Customer 109,P0886,10,2025-10-25,01/11/2025,Inform customer once order is sent
O172739,C0833,Customer 833,P0314,16,13/10/2025,16/10/2025,Pay in 90 days
O172740,C0810,Customer 810,P0533,14,10-13-2025,10-22-2025,
O172741,C0094,Customer 94,P0736,8,19/10/2025,2025-10-29,Inform customer once order is sent
O172742,C0620,Customer 620,P0735,14,2025-10-26,31/10/2025,
O172743,C0208,Customer 208,P0053,6,06/10/2025,10-07-2025,Inform customer once order is sent
O172744,C0521,Customer 521,P0324,2,10-01-2025,09/10/2025,Inform customer once order is sent
O172745,C0382,Customer 382,P0522,2,19/10/2025,24/10/2025,Inform customer once order is sent
O172746,C0714,Customer 714,P0204,14,28/10/2025,2025-11-05,Inform customer once order is sent
O172747,C0227,Customer 227,P0675,6,10-17-2025,10-21-2025,Inform customer once order is sent
O172748,C0321,Customer 321,P0864,7,10-21-2025,30/10/2025,
O172749,C0692,Customer 692,P0095,11,10-19-2025,21/10/2025,
O172750,C0894,Customer 894,P0618,14,16/10/2025,2025-10-17,Pay in 90 days
O172751,C0816,Customer 816,P0109,19,2025-10-03,06/10/2025,Inform customer once order is sent
O172752,C0153,Customer 153,P0136,5,2025-10-25,2025-10-28,Inform customer once order is sent
O172753,C0204,Customer 204,P0435,14,12/10/2025,2025-10-14,
O172754,C0286,Customer 286,P0056,18,2025-10-16,10-22-2025,Pay in 90 days
O172755,C0279,Customer 279,P0260,13,2025-10-24,01/11/2025,Pay in 90 days
O172756,C0414,Customer 414,P0134,15,12/10/2025,10-22-2025,Inform customer once order is sent
O172757,C0773,Customer 773,P0509,16,10-12-2025,10-22-2025,
O172758,C0621,Customer 621,P0219,10,2025-10-19,10-25-2025,Inform customer once order is sent
O172759,C0069,Customer 69,P0238,11,10-25-2025,02/11/2025,Pay in 90 days
O172760,C0584,Customer 584,P0196,5,03/10/2025,12/10/2025,
O172761,C0654,Customer 654,P0342,16,2025-10-24,26/10/2025,Pay in 90 days
O172762,C0034,Customer 34,P0636,17,13/10/2025,2025-10-21,Pay in 90 days
O172763,C0978,Customer 978,P0365,19,10-08-2025,2025-10-16,Pay in 90 days
O172764,C0680,Customer 680,P0021,17,2025-10-11,20/10/2025,Pay in 90 days
O172765,C0859,Customer 859,P0620,13,10-28-2025,2025-10-30,Inform customer once order is sent
O172766,C0112,Customer 112,P0317,11,17/10/2025,21/10/2025,Pay in 90 days
O172767,C0141,Customer 141,P0764,10,03/10/2025,10-04-2025,Inform customer once order is sent
O172768,C0580,Customer 580,P0495,4,10-14-2025,2025-10-19,
O172769,C0167,Customer 167,P0189,4,20/10/2025,30/10/2025,
O172770,C0369,Customer 369,P0835,1,2025-10-01,2025-10-03,Pay in 90 days
O172771,C0473,Customer 473,P0760,7,04/10/2025,2025-10-08,Pay in 90 days
O172772,C0519,Customer 519,P0535,8,10-05-2025,2025-10-06,
O172773,C0310,Customer 310,P0748,16,13/10/2025,15/10/2025,
O172774,C0534,Customer 534,P0727,1,2025-10-28,31/10/2025,Inform customer once order is sent
O172775,C0936,Customer 936,P0815,17,10-15-2025,2025-10-25,Inform customer once order is sent
O172776,C0265,Customer 265,P0151,18,10-20-2025,10-23-2025,
O172777,C0782,Customer 782,P0129,7,10-25-2025,11-01-2025,Inform customer once order is sent
O172778,C0446,Customer 446,P0510,11,21/10/2025,2025-10-25,Inform customer once order is sent
O172779,C0171,Customer 171,P0166,12,24/10/2025,10-28-2025,Pay in 90 days
O172780,C0721,Customer 721,P0680,16,2025-10-14,2025-10-16,
O172781,C0691,Customer 691,P0437,11,2025-10-12,2025-10-21,
O172782,C0387,Customer 387,P0607,11,09/10/2025,2025-10-10,Inform customer once order is sent
O172783,C0258,Customer 258,P0185,5,2025-10-27,11-03-2025,
O172784,C0025,Customer 25,P0205,20,2025-10-23,29/10/2025,Pay in 90 days
O172785,C0662,Customer 662,P0409,5,12/10/2025,22/10/2025,
O172786,C0228,Customer 228,P0142,4,01/10/2025,2025-10-04,
O172787,C0802,Customer 802,P0727,12,10-17-2025,22/10/2025,
O172788,C0353,Customer 353,P0065,11,2025-10-04,10-11-2025,Inform customer once order is sent
O172789,C0247,Customer 247,P0479,19,10-12-2025,2025-10-21,
O172790,C0682,Customer 682,P0698,6,10-26-2025,2025-10-29,
O172791,C0885,Customer 885,P0029,14,17/10/2025,2025-10-25,
O172792,C0973,Customer 973,P0105,18,28/10/2025,11-07-2025,Inform customer once order is sent
O172793,C0942,Customer 942,P0021,17,10-12-2025,10-16-2025,Inform customer once order is sent
O172794,C0651,Customer 651,P0374,20,25/10/2025,2025-10-27,Pay in 90 days
O172795,C0904,Customer 904,P0626,18,10-26-2025,03/11/2025,Inform customer once order is sent
O172796,C0997,Customer 997,P0667,18,2025-10-14,10-15-2025,Pay in 90 days
O172797,C0002,Customer 2,P0295,13,10-21-2025,2025-10-23,Inform customer once order is sent
O172798,C0824,Customer 824,P0478,16,10-04-2025,10-12-2025,Inform customer once order is sent
O172799,C0986,Customer 986,P0878,2,2025-10-10,2025-10-20,Inform customer once order is sent
O172800,C0291,Customer 291,P0152,2,2025-10-21,2025-10-29,Inform customer once order is sent
O172801,C0429,Customer 429,P0221,15,09/10/2025,2025-10-11,
O172802,C0924,Customer 924,P0773,2,10-03-2025,2025-10-10,Pay in 90 days
O172803,C0523,Customer 523,P0488,9,2025-10-28,10-29-2025,Pay in 90 days
O172804,C0681,Customer 681,P0594,7,03/10/2025,10-06-2025,
O172805,C0111,Customer 111,P0052,14,10-22-2025,2025-10-27,Inform customer once order is sent
O172806,C0266,Customer 266,P0311,18,2025-10-05,10-13-2025,Pay in 90 days
O172807,C0061,Customer 61,P0168,17,2025-10-01,10-06-2025,Pay in 90 days
O172808,C0557,Customer 557,P0419,18,2025-10-11,10-14-2025,Inform customer once order is sent
O172809,C0585,Customer 585,P0570,10,01/10/2025,2025-10-07,Inform customer once order is sent
O172810,C0293,Customer 293,P0789,2,2025-10-10,10-17-2025,Pay in 90 days
O172811,C0734,Customer 734,P0669,9,10-25-2025,2025-10-29,Inform customer once order is sent
O172812,C0560,Customer 560,P0285,1,2025-10-13,10-18-2025,Inform customer once order is sent
O172813,C0908,Customer 908,P0618,14,22/10/2025,10-30-2025,
O172814,C0718,Customer 718,P0694,15,10-06-2025,13/10/2025,
O172815,C0949,Customer 949,P0101,18,17/10/2025,10-21-2025,Inform customer once order is sent
O172816,C0814,Customer 814,P0373,4,28/10/2025,07/11/2025,Inform customer once order is sent
O172817,C0334,Customer 334,P0716,2,10-24-2025,2025-11-02,Inform customer once order is sent
O172818,C0480,Customer 480,P0667,8,10-02-2025,10/10/2025,Pay in 90 days
O172819,C0848,Customer 848,P0351,19,10-14-2025,10-21-2025,Pay in 90 days
O172820,C0691,Customer 691,P0723,19,10-14-2025,2025-10-21,Pay in 90 days
O172821,C0541,Customer 541,P0674,18,10-23-2025,10-30-2025,
O172822,C0648,Customer 648,P0056,11,2025-10-27,2025-11-05,
O172823,C0493,Customer 493,P0851,16,10-05-2025,11/10/2025,Inform customer once order is sent
O172824,C0950,Customer 950,P0632,6,05/10/2025,2025-10-10,Pay in 90 days
O172825,C0359,Customer 359,P0179,13,10-01-2025,10-10-2025,
O172826,C0152,Customer 152,P0757,11,22/10/2025,2025-10-26,
O172827,C0481,Customer 481,P0398,6,10-12-2025,2025-10-15,
O172828,C0051,Customer 51,P0303,15,10-01-2025,10-05-2025,
O172829,C0059,Customer 59,P0809,19,2025-10-18,10-26-2025,Inform customer once order is sent
O172830,C0834,Customer 834,P0441,6,10-20-2025,2025-10-23,Pay in 90 days
O172831,C0176,Customer 176,P0315,19,03/10/2025,10-06-2025,Pay in 90 days
O172832,C0619,Customer 619,P0118,9,13/10/2025,21/10/2025,Pay in 90 days
O172833,C0963,Customer 963,P0425,12,12/10/2025,13/10/2025,
O172834,C0001,Customer 1,P0811,3,2025-10-06,08/10/2025,Inform customer once order is sent
O172835,C0509,Customer 509,P0195,16,14/10/2025,21/10/2025,Inform customer once order is sent
O172836,C0686,Customer 686,P0348,4,10-23-2025,11-01-2025,Inform customer once order is sent
O172837,C0300,Customer 300,P0088,10,2025-10-16,10-24-2025,Pay in 90 days
O172838,C0188,Customer 188,P0569,17,2025-10-22,27/10/2025,Inform customer once order is sent
O172839,C0594,Customer 594,P0663,8,2025-10-02,2025-10-03,
O172840,C0803,Customer 803,P0625,5,10-01-2025,2025-10-09,
O172841,C0048,Customer 48,P0863,14,01/10/2025,10-06-2025,Pay in 90 days
O172842,C0402,Customer 402,P0124,6,10-22-2025,23/10/2025,Inform customer once order is sent
O172843,C0938,Customer 938,P0416,16,2025-10-16,2025-10-17,Inform customer once order is sent
O172844,C0211,Customer 211,P0024,16,16/10/2025,20/10/2025,Pay in 90 days
O172845,C0959,Customer 959,P0526,1,2025-10-20,10-23-2025,Inform customer once order is sent
O172846,C0800,Customer 800,P0775,18,11/10/2025,2025-10-17,
O172847,C0895,Customer 895,P0194,4,13/10/2025,23/10/2025,
O172848,C0225,Customer 225,P0240,8,19/10/2025,26/10/2025,Pay in 90 days
O172849,C0136,Customer 136,P0674,9,10-26-2025,2025-10-27,
O172850,C0297,Customer 297,P0610,17,10-11-2025,2025-10-12,Inform customer once order is sent
O172851,C0310,Customer 310,P0717,7,10-23-2025,2025-10-24,Inform customer once order is sent
O172852,C0340,Customer 340,P0567,8,10-22-2025,29/10/2025,
O172853,C0762,Customer 762,P0473,6,10-01-2025,2025-10-07,
O172854,C0906,Customer 906,P0132,12,2025-10-02,2025-10-07,Inform customer once order is sent
O172855,C0296,Customer 296,P0730,8,06/10/2025,10-11-2025,Inform customer once order is sent
O172856,C0598,Customer 598,P0833,9,2025-10-05,2025-10-15,Pay in 90 days
O172857,C0465,Customer 465,P0793,17,03/10/2025,10-09-2025,
O172858,C0685,Customer 685,P0712,9,10-24-2025,03/11/2025,Inform customer once order is sent
O172859,C0572,Customer 572,P0068,13,10-25-2025,11-01-2025,
O172860,C0375,Customer 375,P0099,17,2025-10-15,2025-10-23,Inform customer once order is sent
O172861,C0162,Customer 162,P0423,20,2025-10-16,10-17-2025,Inform customer once order is sent
O172862,C0853,Customer 853,P0558,20,2025-10-07,15/10/2025,
O172863,C0321,Customer 321,P0489,14,2025-10-03,10-05-2025,Pay in 90 days
O172864,C0874,Customer 874,P0271,3,2025-10-13,2025-10-21,Pay in 90 days
O172865,C0403,Customer 403,P0360,6,10-10-2025,14/10/2025,Pay in 90 days
O172866,C0011,Customer 11,P0870,7,2025-10-05,13/10/2025,Inform customer once order is sent
O172867,C0788,Customer 788,P0427,18,10-21-2025,25/10/2025,Pay in 90 days
O172868,C0091,Customer 91,P0318,11,10-21-2025,10-22-2025,Inform customer once order is sent
O172869,C0897,Customer 897,P0531,13,2025-10-08,10-16-2025,Inform customer once order is sent
O172870,C0741,Customer 741,P0631,18,09/10/2025,10-18-2025,Pay in 90 days
O172871,C0169,Customer 169,P0069,11,26/10/2025,29/10/2025,Pay in 90 days
O172872,C0468,Customer 468,P0059,2,2025-10-21,10-25-2025,
O172873,C0129,Customer 129,P0660,6,2025-10-10,11/10/2025,Pay in 90 days
O172874,C0789,Customer 789,P0003,5,10/10/2025,10-17-2025,Pay in 90 days
O172875,C0775,Customer 775,P0793,7,10-28-2025,01/11/2025,Inform customer once order is sent
O172876,C0993,Customer 993,P0735,10,26/10/2025,2025-10-28,Inform customer once order is sent
O172877,C0167,Customer 167,P0378,9,22/10/2025,23/10/2025,Pay in 90 days
O172878,C0731,Customer 731,P0010,5,10-15-2025,2025-10-16,Pay in 90 days
O172879,C0200,Customer 200,P0033,10,2025-10-23,2025-10-29,
O172880,C0555,Customer 555,P0365,8,2025-10-10,20/10/2025,
O172881,C0719,Customer 719,P0244,17,2025-10-10,2025-10-20,Inform customer once order is sent
O172882,C0685,Customer 685,P0011,7,10-23-2025,10-30-2025,
O172883,C0399,Customer 399,P0603,15,02/10/2025,08/10/2025,Inform customer once order is sent
O172884,C0835,Customer 835,P0464,7,06/10/2025,2025-10-12,Pay in 90 days
O172885,C0818,Customer 818,P0473,4,27/10/2025,2025-11-03,Pay in 90 days
O172886,C0784,Customer 784,P0833,17,10-28-2025,2025-11-02,
O172887,C0057,Customer 57,P0806,13,10-15-2025,16/10/2025,Pay in 90 days
O172888,C0810,Customer 810,P0723,11,2025-10-01,10-10-2025,Pay in 90 days
O172889,C0999,Customer 999,P0878,12,26/10/2025,10-30-2025,
O172890,C0304,Customer 304,P0204,19,02/10/2025,10-11-2025,Pay in 90 days
O172891,C0623,Customer 623,P0503,18,10-05-2025,10-14-2025,
O172892,C0160,Customer 160,P0540,16,03/10/2025,10/10/2025,Pay in 90 days
O172893,C0203,Customer 203,P0211,17,2025-10-14,15/10/2025,Pay in 90 days
O172894,C0076,Customer 76,P0295,4,10/10/2025,15/10/2025,Pay in 90 days
O172895,C0040,Customer 40,P0343,6,2025-10-11,10-17-2025,
O172896,C0848,Customer 848,P0773,7,04/10/2025,07/10/2025,Pay in 90 days
O172897,C0148,Customer 148,P0128,18,04/10/2025,2025-10-05,
O172898,C0426,Customer 426,P0278,13,24/10/2025,10-31-2025,
O172899,C0417,Customer 417,P0846,4,10-09-2025,12/10/2025,Inform customer once order is sent
O172900,C0152,Customer 152,P0192,9,2025-10-28,10-30-2025,Pay in 90 days
O172901,C0923,Customer 923,P0106,5,28/10/2025,05/11/2025,Inform customer once order is sent
O172902,C0604,Customer 604,P0214,14,2025-10-05,08/10/2025,
O172903,C0243,Customer 243,P0104,10,21/10/2025,2025-10-23,
O172904,C0905,Customer 905,P0146,10,21/10/2025,10-26-2025,Inform customer once order is sent
O172905,C0697,Customer 697,P0681,15,2025-10-16,2025-10-25,
O172906,C0989,Customer 989,P0441,10,10-12-2025,2025-10-16,Inform customer once order is sent
O172907,C0481,Customer 481,P0612,6,10-06-2025,2025-10-10,Pay in 90 days
O172908,C0856,Customer 856,P0722,19,12/10/2025,20/10/2025,Pay in 90 days
O172909,C0639,Customer 639,P0269,17,12/10/2025,2025-10-17,
O172910,C0932,Customer 932,P0084,15,2025-10-23,10-26-2025,Pay in 90 days
O172911,C0142,Customer 142,P0043,15,2025-10-21,31/10/2025,
O172912,C0673,Customer 673,P0514,11,01/10/2025,10-05-2025,
O172913,C0174,Customer 174,P0222,16,2025-10-15,2025-10-18,
O172914,C0242,Customer 242,P0440,11,25/10/2025,2025-10-30,Inform customer once order is sent
O172915,C0617,Customer 617,P0127,8,11/10/2025,2025-10-12,Pay in 90 days
O172916,C0446,Customer 446,P0167,1,03/10/2025,10/10/2025,Inform customer once order is sent
O172917,C0111,Customer 111,P0596,7,03/10/2025,06/10/2025,Pay in 90 days
O172918,C0556,Customer 556,P0121,6,15/10/2025,10-22-2025,
O172919,C0909,Customer 909,P0612,14,08/10/2025,10-09-2025,Pay in 90 days
O172920,C0738,Customer 738,P0842,8,10-12-2025,10-13-2025,Pay in 90 days
O172921,C0157,Customer 157,P0659,17,2025-10-26,2025-11-04,
O172922,C0117,Customer 117,P0302,13,2025-10-16,26/10/2025,
O172923,C0278,Customer 278,P0079,20,28/10/2025,2025-11-05,Inform customer once order is sent
O172924,C0043,Customer 43,P0254,2,02/10/2025,2025-10-04,Inform customer once order is sent
O172925,C0694,Customer 694,P0067,15,2025-10-26,2025-11-01,Pay in 90 days
O172926,C0367,Customer 367,P0465,5,2025-10-22,2025-10-26,
O172927,C0017,Customer 17,P0345,19,06/10/2025,10-12-2025,Inform customer once order is sent
O172928,C0533,Customer 533,P0324,10,2025-10-19,24/10/2025,Inform customer once order is sent
O172929,C0646,Customer 646,P0642,15,01/10/2025,06/10/2025,Inform customer once order is sent
O172930,C0862,Customer 862,P0114,5,10-10-2025,10-18-2025,Inform customer once order is sent
O172931,C0065,Customer 65,P0188,8,25/10/2025,04/11/2025,
O172932,C0875,Customer 875,P0416,19,2025-10-19,2025-10-24,
O172933,C0344,Customer 344,P0847,3,25/10/2025,26/10/2025,Inform customer once order is sent
O172934,C0679,Customer 679,P0287,20,2025-10-08,18/10/2025,Pay in 90 days
O172935,C0568,Customer 568,P0244,10,07/10/2025,2025-10-08,
O172936,C0715,Customer 715,P0446,7,06/10/2025,08/10/2025,Pay in 90 days
O172937,C0823,Customer 823,P0176,7,2025-10-20,29/10/2025,
O172938,C0635,Customer 635,P0804,20,21/10/2025,30/10/2025,Pay in 90 days
O172939,C0119,Customer 119,P0526,12,03/10/2025,10-10-2025,Inform customer once order is sent
O172940,C0072,Customer 72,P0388,2,10-22-2025,28/10/2025,
O172941,C0792,Customer 792,P0207,14,2025-10-21,31/10/2025,Pay in 90 days
O172942,C0765,Customer 765,P0027,15,2025-10-11,2025-10-21,Inform customer once order is sent
O172943,C0134,Customer 134,P0791,7,10-22-2025,10-27-2025,
O172944,C0799,Customer 799,P0895,9,10-07-2025,12/10/2025,Inform customer once order is sent
O172945,C0551,Customer 551,P0158,14,2025-10-13,23/10/2025,
O172946,C0313,Customer 313,P0687,19,10-22-2025,23/10/2025,Pay in 90 days
O172947,C0647,Customer 647,P0047,10,05/10/2025,10-10-2025,Pay in 90 days
O172948,C0485,Customer 485,P0106,12,27/10/2025,2025-10-28,
O172949,C0782,Customer 782,P0890,5,10-20-2025,10-28-2025,Pay in 90 days
O172950,C0048,Customer 48,P0432,13,2025-10-20,2025-10-24,Inform customer once order is sent
O172951,C0648,Customer 648,P0336,11,20/10/2025,2025-10-30,
O172952,C0084,Customer 84,P0853,9,2025-10-02,10-11-2025,Pay in 90 days
O172953,C0853,Customer 853,P0194,10,09/10/2025,10-14-2025,Pay in 90 days
O172954,C0858,Customer 858,P0157,19,12/10/2025,2025-10-22,Inform customer once order is sent
O172955,C0052,Customer 52,P0234,7,10-23-2025,10-26-2025,Inform customer once order is sent
O172956,C0360,Customer 360,P0248,14,2025-10-21,10-31-2025,
O172957,C0764,Customer 764,P0684,20,2025-10-09,12/10/2025,Inform customer once order is sent
O172958,C0403,Customer 403,P0520,1,10-07-2025,2025-10-15,
O172959,C0051,Customer 51,P0644,8,10-20-2025,2025-10-23,Inform customer once order is sent
O172960,C0304,Customer 304,P0016,16,10-10-2025,17/10/2025,Pay in 90 days
O172961,C0123,Customer 123,P0362,15,10-18-2025,2025-10-22,Pay in 90 days
O172962,C0087,Customer 87,P0141,7,05/10/2025,10-10-2025,Pay in 90 days
O172963,C0888,Customer 888,P0682,13,17/10/2025,20/10/2025,
O172964,C0178,Customer 178,P0792,7,2025-10-27,06/11/2025,Inform customer once order is sent
O172965,C0530,Customer 530,P0874,11,2025-10-10,20/10/2025,Inform customer once order is sent
O172966,C0464,Customer 464,P0063,20,17/10/2025,25/10/2025,
O172967,C0973,Customer 973,P0674,12,13/10/2025,2025-10-16,Pay in 90 days
O172968,C0201,Customer 201,P0761,17,10-13-2025,10-14-2025,Inform customer once order is sent
O172969,C0024,Customer 24,P0898,16,10-24-2025,11-02-2025,
O172970,C0775,Customer 775,P0823,20,04/10/2025,10-09-2025,Inform customer once order is sent
O172971,C0024,Customer 24,P0283,9,27/10/2025,05/11/2025,Inform customer once order is sent
O172972,C0227,Customer 227,P0729,2,10-08-2025,10-09-2025,Inform customer once order is sent
O172973,C0343,Customer 343,P0253,8,10-13-2025,2025-10-15,
O172974,C0034,Customer 34,P0502,10,10-10-2025,17/10/2025,
O172975,C0564,Customer 564,P0536,7,24/10/2025,10-29-2025,
O172976,C0169,Customer 169,P0888,12,10-13-2025,2025-10-23,Inform customer once order is sent
O172977,C0675,Customer 675,P0874,13,25/10/2025,11-03-2025,
O172978,C0131,Customer 131,P0389,11,2025-10-01,08/10/2025,Inform customer once order is sent
O172979,C0099,Customer 99,P0091,10,10-01-2025,10-09-2025,
O172980,C0098,Customer 98,P0321,18,10-12-2025,21/10/2025,Pay in 90 days
O172981,C0716,Customer 716,P0494,8,2025-10-25,02/11/2025,Inform customer once order is sent
O172982,C0982,Customer 982,P0190,9,2025-10-15,10-18-2025,Pay in 90 days
O172983,C0929,Customer 929,P0158,9,15/10/2025,2025-10-18,Pay in 90 days
O172984,C0707,Customer 707,P0507,5,2025-10-15,10-21-2025,Inform customer once order is sent
O172985,C0591,Customer 591,P0221,17,2025-10-26,10-27-2025,
O172986,C0416,Customer 416,P0193,14,10-05-2025,10-12-2025,Inform customer once order is sent
O172987,C0670,Customer 670,P0063,19,10-08-2025,10-09-2025,Inform customer once order is sent
O172988,C0260,Customer 260,P0259,3,10-14-2025,15/10/2025,Inform customer once order is sent
O172989,C0036,Customer 36,P0271,1,2025-10-11,10-20-2025,Inform customer once order is sent
O172990,C0169,Customer 169,P0395,7,23/10/2025,10-31-2025,Inform customer once order is sent
O172991,C0338,Customer 338,P0618,17,10-23-2025,10-24-2025,
O172992,C0937,Customer 937,P0868,5,2025-10-21,10-23-2025,Inform customer once order is sent
O172993,C0607,Customer 607,P0425,15,10-01-2025,11/10/2025,Pay in 90 days
O172994,C0539,Customer 539,P0645,2,10-03-2025,2025-10-04,Inform customer once order is sent
O172995,C0140,Customer 140,P0073,3,2025-10-14,10-15-2025,Pay in 90 days
O172996,C0532,Customer 532,P0156,15,10-16-2025,2025-10-17,Inform customer once order is sent
O172997,C0764,Customer 764,P0848,16,2025-10-01,10-10-2025,
O172998,C0195,Customer 195,P0103,6,10-25-2025,2025-10-26,
O172999,C0613,Customer 613,P0877,4,10-25-2025,03/11/2025,
O173000,C0483,Customer 483,P0003,16,07/10/2025,2025-10-17,Pay in 90 days
O173001,C0923,Customer 923,P0275,5,10-18-2025,24/10/2025,
O173002,C0361,Customer 361,P0407,6,03/10/2025,2025-10-06,Inform customer once order is sent
O173003,C0555,Customer 555,P0468,14,2025-10-17,10-22-2025,Inform customer once order is sent
O173004,C0947,Customer 947,P0867,11,18/10/2025,20/10/2025,Inform customer once order is sent
O173005,C0008,Customer 8,P0455,14,2025-10-10,14/10/2025,Inform customer once order is sent
O173006,C0768,Customer 768,P0180,14,21/10/2025,27/10/2025,
O173007,C0774,Customer 774,P0633,20,17/10/2025,18/10/2025,Inform customer once order is sent
O173008,C0171,Customer 171,P0261,11,10-19-2025,2025-10-24,
O173009,C0787,Customer 787,P0162,5,2025-10-20,10-21-2025,
O173010,C0348,Customer 348,P0773,15,07/10/2025,10-11-2025,Pay in 90 days
O173011,C0758,Customer 758,P0399,5,07/10/2025,2025-10-17,Inform customer once order is sent
O173012,C0804,Customer 804,P0719,13,2025-10-04,09/10/2025,Inform customer once order is sent
O173013,C0535,Customer 535,P0225,11,2025-10-16,2025-10-24,
O173014,C0561,Customer 561,P0420,12,10-13-2025,2025-10-15,Pay in 90 days
O173015,C1000,Customer 1000,P0236,2,2025-10-16,18/10/2025,Pay in 90 days
O173016,C0355,Customer 355,P0269,15,25/10/2025,2025-10-27,Inform customer once order is sent
O173017,C0105,Customer 105,P0864,8,10-12-2025,10-20-2025,Pay in 90 days
O173018,C0063,Customer 63,P0306,9,25/10/2025,2025-11-03,Pay in 90 days
O173019,C0924,Customer 924,P0104,8,2025-10-20,10-30-2025,Inform customer once order is sent
O173020,C0151,Customer 151,P0177,17,10-15-2025,17/10/2025,
O173021,C0897,Customer 897,P0257,20,2025-10-19,29/10/2025,Pay in 90 days
O173022,C0830,Customer 830,P0377,13,21/10/2025,2025-10-24,Pay in 90 days
O173023,C0721,Customer 721,P0787,3,10-17-2025,2025-10-20,Pay in 90 days
O173024,C0704,Customer 704,P0553,5,08/10/2025,10-14-2025,Pay in 90 days
O173025,C0250,Customer 250,P0891,8,10-21-2025,29/10/2025,Inform customer once order is sent
O173026,C0767,Customer 767,P0579,12,09/10/2025,13/10/2025,Inform customer once order is sent
O173027,C0629,Customer 629,P0439,5,2025-10-26,11-02-2025,Pay in 90 days
O173028,C0949,Customer 949,P0689,17,15/10/2025,10-17-2025,
O173029,C0216,Customer 216,P0041,1,2025-10-05,2025-10-13,Pay in 90 days
O173030,C0753,Customer 753,P0748,13,08/10/2025,10-09-2025,Inform customer once order is sent
O173031,C0180,Customer 180,P0627,4,28/10/2025,2025-10-30,
O173032,C0388,Customer 388,P0291,15,2025-10-04,10-11-2025,Inform customer once order is sent
O173033,C0720,Customer 720,P0401,11,2025-10-13,2025-10-22,Inform customer once order is sent
O173034,C0380,Customer 380,P0039,1,19/10/2025,23/10/2025,
O173035,C0916,Customer 916,P0687,9,2025-10-19,21/10/2025,
O173036,C0459,Customer 459,P0102,4,20/10/2025,26/10/2025,Inform customer once order is sent
O173037,C0133,Customer 133,P0886,7,2025-10-06,15/10/2025,Inform customer once order is sent
O173038,C0145,Customer 145,P0726,8,03/10/2025,10-13-2025,Pay in 90 days
O173039,C0927,Customer 927,P0043,5,17/10/2025,2025-10-27,
O173040,C0257,Customer 257,P0308,18,24/10/2025,01/11/2025,Inform customer once order is sent
O173041,C0748,Customer 748,P0788,14,10-24-2025,30/10/2025,
O173042,C0900,Customer 900,P0238,12,10-14-2025,10-21-2025,
O173043,C0245,Customer 245,P0624,3,10-16-2025,10-25-2025,Inform customer once order is sent
O173044,C0814,Customer 814,P0085,14,14/10/2025,10-16-2025,Pay in 90 days
O173045,C0775,Customer 775,P0232,3,10-26-2025,2025-11-02,
O173046,C0183,Customer 183,P0834,14,10-15-2025,25/10/2025,Inform customer once order is sent
O173047,C0462,Customer 462,P0342,15,2025-10-10,10-14-2025,Inform customer once order is sent
O173048,C0947,Customer 947,P0007,14,23/10/2025,10-27-2025,Pay in 90 days
O173049,C0681,Customer 681,P0175,3,10-25-2025,2025-11-01,
O173050,C0964,Customer 964,P0348,2,10-17-2025,10-25-2025,
O173051,C0038,Customer 38,P0037,14,17/10/2025,21/10/2025,
O173052,C0117,Customer 117,P0230,5,2025-10-12,16/10/2025,Pay in 90 days
O173053,C0793,Customer 793,P0658,9,12/10/2025,16/10/2025,Pay in 90 days
O173054,C0312,Customer 312,P0576,3,10-01-2025,2025-10-02,
O173055,C0687,Customer 687,P0465,11,10-16-2025,10-17-2025,Inform customer once order is sent
O173056,C0963,Customer 963,P0120,15,25/10/2025,10-29-2025,
O173057,C0890,Customer 890,P0602,7,2025-10-19,22/10/2025,Pay in 90 days
O173058,C0655,Customer 655,P0421,20,2025-10-05,10-08-2025,Inform customer once order is sent
O173059,C0049,Customer 49,P0174,15,10-18-2025,22/10/2025,Inform customer once order is sent
O173060,C0972,Customer 972,P0101,11,19/10/2025,2025-10-20,Inform customer once order is sent
O173061,C0729,Customer 729,P0687,13,14/10/2025,22/10/2025,Pay in 90 days
O173062,C0855,Customer 855,P0359,5,26/10/2025,11-02-2025,Pay in 90 days
O173063,C0421,Customer 421,P0638,7,04/10/2025,2025-10-07,Inform customer once order is sent
O173064,C0640,Customer 640,P0238,17,16/10/2025,10-22-2025,
O173065,C0941,Customer 941,P0658,20,10-05-2025,2025-10-10,
O173066,C0990,Customer 990,P0757,19,10-08-2025,16/10/2025,Pay in 90 days
O173067,C0458,Customer 458,P0172,8,2025-10-26,10-27-2025,
O173068,C0826,Customer 826,P0892,19,10-11-2025,2025-10-16,
O173069,C0050,Customer 50,P0288,13,10-20-2025,30/10/2025,Inform customer once order is sent
O173070,C0040,Customer 40,P0311,1,2025-10-18,2025-10-26,Inform customer once order is sent
O173071,C0331,Customer 331,P0824,8,10-23-2025,2025-10-30,Inform customer once order is sent
O173072,C0372,Customer 372,P0767,19,2025-10-06,10-13-2025,
O173073,C0103,Customer 103,P0677,3,2025-10-25,10-30-2025,Inform customer once order is sent
O173074,C0273,Customer 273,P0260,2,2025-10-28,31/10/2025,
O173075,C0847,Customer 847,P0015,18,08/10/2025,2025-10-17,Inform customer once order is sent
O173076,C0188,Customer 188,P0125,13,2025-10-18,10-26-2025,Inform customer once order is sent
O173077,C0947,Customer 947,P0074,18,18/10/2025,26/10/2025,
O173078,C0412,Customer 412,P0058,5,2025-10-19,10-22-2025,Pay in 90 days
O173079,C0580,Customer 580,P0435,15,10-26-2025,05/11/2025,Inform customer once order is sent
O173080,C0810,Customer 810,P0253,12,10-17-2025,10-18-2025,Inform customer once order is sent
O173081,C0612,Customer 612,P0058,2,17/10/2025,2025-10-27,
O173082,C0337,Customer 337,P0043,3,2025-10-28,11-05-2025,Pay in 90 days
O173083,C0941,Customer 941,P0104,6,10-26-2025,2025-10-28,Pay in 90 days
O173084,C0592,Customer 592,P0247,17,08/10/2025,10-10-2025,Pay in 90 days
O173085,C0784,Customer 784,P0258,18,10/10/2025,2025-10-11,
O173086,C0434,Customer 434,P0623,16,10-26-2025,10-30-2025,
O173087,C0510,Customer 510,P0198,8,22/10/2025,2025-10-25,
O173088,C0711,Customer 711,P0136,9,10-10-2025,10-13-2025,
O173089,C0717,Customer 717,P0302,4,10-21-2025,2025-10-26,
O173090,C0770,Customer 770,P0871,13,25/10/2025,2025-10-30,
O173091,C0106,Customer 106,P0196,10,10-01-2025,11/10/2025,
O173092,C0517,Customer 517,P0043,14,2025-10-01,2025-10-11,
O173093,C0752,Customer 752,P0244,7,08/10/2025,2025-10-13,Inform customer once order is sent
O173094,C0069,Customer 69,P0768,15,08/10/2025,10-17-2025,Inform customer once order is sent
O173095,C0972,Customer 972,P0227,9,14/10/2025,22/10/2025,Inform customer once order is sent
O173096,C0228,Customer 228,P0869,4,2025-10-08,15/10/2025,Inform customer once order is sent
O173097,C0576,Customer 576,P0323,8,18/10/2025,2025-10-25,
O173098,C0851,Customer 851,P0401,15,2025-10-11,2025-10-19,Inform customer once order is sent
O173099,C0845,Customer 845,P0604,5,2025-10-24,2025-10-25,Pay in 90 days
O173100,C0808,Customer 808,P0824,18,2025-10-11,19/10/2025,Pay in 90 days
O173101,C0673,Customer 673,P0543,18,19/10/2025,2025-10-22,
O173102,C0926,Customer 926,P0730,1,23/10/2025,28/10/2025,
O173103,C0474,Customer 474,P0115,8,10-05-2025,10-13-2025,Pay in 90 days
O173104,C0568,Customer 568,P0142,13,10-18-2025,10-24-2025,Pay in 90 days
O173105,C0277,Customer 277,P0547,16,24/10/2025,2025-10-25,Inform customer once order is sent
O173106,C0709,Customer 709,P0088,12,26/10/2025,10-29-2025,Inform customer once order is sent
O173107,C0339,Customer 339,P0397,17,21/10/2025,2025-10-27,Pay in 90 days
O173108,C0038,Customer 38,P0595,14,10-19-2025,10-29-2025,
O173109,C0559,Customer 559,P0471,19,2025-10-13,10-23-2025,
O173110,C0256,Customer 256,P0853,10,23/10/2025,10-26-2025,Inform customer once order is sent
O173111,C0903,Customer 903,P0404,14,14/10/2025,2025-10-21,
O173112,C0820,Customer 820,P0576,1,2025-10-27,2025-10-29,
O173113,C0546,Customer 546,P0065,2,01/10/2025,04/10/2025,Pay in 90 days
O173114,C0208,Customer 208,P0831,1,10-15-2025,2025-10-22,Pay in 90 days
O173115,C0082,Customer 82,P0731,14,10-19-2025,23/10/2025,
O173116,C0994,Customer 994,P0416,8,11/10/2025,10-17-2025,Pay in 90 days
O173117,C0177,Customer 177,P0579,20,2025-10-13,10-17-2025,Inform customer once order is sent
O173118,C0928,Customer 928,P0873,6,01/10/2025,10-04-2025,Inform customer once order is sent
O173119,C0310,Customer 310,P0017,6,2025-10-15,22/10/2025,Inform customer once order is sent
O173120,C0082,Customer 82,P0095,3,10-15-2025,10-22-2025,Pay in 90 days
O173121,C0313,Customer 313,P0009,18,2025-10-18,26/10/2025,
O173122,C0377,Customer 377,P0816,19,2025-10-17,2025-10-20,Inform customer once order is sent
O173123,C0019,Customer 19,P0449,18,06/10/2025,13/10/2025,Pay in 90 days
O173124,C0453,Customer 453,P0158,5,17/10/2025,2025-10-19,Pay in 90 days
O173125,C0137,Customer 137,P0086,1,22/10/2025,10-26-2025,Pay in 90 days
O173126,C0736,Customer 736,P0030,12,2025-10-25,10-30-2025,Inform customer once order is sent
O173127,C0107,Customer 107,P0279,3,02/10/2025,2025-10-08,
O173128,C0137,Customer 137,P0859,20,10-28-2025,10-30-2025,Pay in 90 days
O173129,C0859,Customer 859,P0753,11,16/10/2025,2025-10-26,
O173130,C0353,Customer 353,P0320,2,10-26-2025,28/10/2025,Inform customer once order is sent
O173131,C0041,Customer 41,P0415,4,10-16-2025,10-18-2025,Pay in 90 days
O173132,C0080,Customer 80,P0261,17,10-16-2025,10-26-2025,Inform customer once order is sent
O173133,C0549,Customer 549,P0232,4,10-10-2025,10-15-2025,Inform customer once order is sent
O173134,C0503,Customer 503,P0783,5,10-15-2025,2025-10-17,Inform customer once order is sent
O173135,C0028,Customer 28,P0440,18,2025-10-24,2025-10-31,
O173136,C0883,Customer 883,P0658,15,15/10/2025,16/10/2025,
O173137,C0174,Customer 174,P0564,19,2025-10-21,10-25-2025,Pay in 90 days
O173138,C0746,Customer 746,P0160,10,10-18-2025,10-21-2025,Inform customer once order is sent
O173139,C0299,Customer 299,P0619,1,2025-10-15,23/10/2025,
O173140,C0420,Customer 420,P0395,7,10-10-2025,16/10/2025,Inform customer once order is sent
O173141,C0540,Customer 540,P0599,6,08/10/2025,16/10/2025,Pay in 90 days
O173142,C0482,Customer 482,P0562,3,10-16-2025,10-23-2025,Inform customer once order is sent
O173143,C0927,Customer 927,P0127,8,10-08-2025,10-11-2025,Inform customer once order is sent
O173144,C0291,Customer 291,P0375,5,09/10/2025,11/10/2025,Pay in 90 days
O173145,C0801,Customer 801,P0205,6,14/10/2025,2025-10-21,Pay in 90 days
O173146,C0235,Customer 235,P0385,2,10-10-2025,2025-10-15,Pay in 90 days
O173147,C0826,Customer 826,P0278,4,10-16-2025,10-21-2025,
O173148,C0841,Customer 841,P0545,4,2025-10-04,2025-10-05,Inform customer once order is sent
O173149,C0701,Customer 701,P0403,13,10-26-2025,10-27-2025,Inform customer once order is sent
O173150,C0013,Customer 13,P0413,17,10/10/2025,10-11-2025,
O173151,C0571,Customer 571,P0515,12,2025-10-02,07/10/2025,Pay in 90 days
O173152,C0750,Customer 750,P0107,1,10-21-2025,10-31-2025,Inform customer once order is sent
O173153,C0152,Customer 152,P0013,7,17/10/2025,2025-10-23,Inform customer once order is sent
O173154,C0452,Customer 452,P0736,3,2025-10-21,2025-10-24,Inform customer once order is sent
O173155,C0294,Customer 294,P0522,19,2025-10-18,20/10/2025,Pay in 90 days
O173156,C0031,Customer 31,P0836,2,17/10/2025,10-23-2025,
O173157,C0495,Customer 495,P0211,2,20/10/2025,23/10/2025,Pay in 90 days
O173158,C0613,Customer 613,P0073,9,23/10/2025,24/10/2025,
O173159,C0708,Customer 708,P0384,5,10-21-2025,10-23-2025,Pay in 90 days
O173160,C0654,Customer 654,P0257,16,10-04-2025,10-11-2025,Inform customer once order is sent
O173161,C0918,Customer 918,P0835,3,10-10-2025,10-20-2025,Inform customer once order is sent
O173162,C0980,Customer 980,P0848,1,21/10/2025,2025-10-29,Inform customer once order is sent
O173163,C0209,Customer 209,P0664,3,14/10/2025,10-18-2025,Pay in 90 days
O173164,C0501,Customer 501,P0183,1,06/10/2025,10-13-2025,
O173165,C0908,Customer 908,P0794,1,2025-10-07,11/10/2025,Inform customer once order is sent
O173166,C0994,Customer 994,P0759,16,03/10/2025,10-06-2025,Pay in 90 days
O173167,C0403,Customer 403,P0084,17,10-19-2025,10-28-2025,Inform customer once order is sent
O173168,C0431,Customer 431,P0116,13,10-26-2025,2025-11-04,
O173169,C0718,Customer 718,P0462,6,10-06-2025,2025-10-12,
O173170,C0764,Customer 764,P0622,11,18/10/2025,2025-10-27,Inform customer once order is sent
O173171,C0366,Customer 366,P0298,7,2025-10-12,10-18-2025,
O173172,C0515,Customer 515,P0501,19,2025-10-20,25/10/2025,Pay in 90 days
O173173,C0959,Customer 959,P0422,4,10-16-2025,2025-10-22,
O173174,C0194,Customer 194,P0195,13,03/10/2025,2025-10-13,Inform customer once order is sent
O173175,C0597,Customer 597,P0149,9,2025-10-23,10-24-2025,Pay in 90 days
O173176,C0787,Customer 787,P0083,19,02/10/2025,10-12-2025,
O173177,C0225,Customer 225,P0027,9,2025-10-14,10-24-2025,
O173178,C0942,Customer 942,P0075,4,2025-10-24,27/10/2025,
O173179,C0526,Customer 526,P0524,20,21/10/2025,23/10/2025,Pay in 90 days
O173180,C0699,Customer 699,P0132,18,10-13-2025,2025-10-20,
O173181,C0769,Customer 769,P0796,11,10-04-2025,2025-10-05,
O173182,C0208,Customer 208,P0159,12,03/10/2025,2025-10-07,Pay in 90 days
O173183,C0086,Customer 86,P0846,17,11/10/2025,10-20-2025,
O173184,C0451,Customer 451,P0074,16,2025-10-28,2025-10-29,Inform customer once order is sent
O173185,C0186,Customer 186,P0883,19,25/10/2025,10-28-2025,Inform customer once order is sent
O173186,C0483,Customer 483,P0185,15,16/10/2025,10-19-2025,Pay in 90 days
O173187,C0081,Customer 81,P0382,2,15/10/2025,2025-10-24,Inform customer once order is sent
O173188,C0539,Customer 539,P0185,16,12/10/2025,10-15-2025,
O173189,C0885,Customer 885,P0760,20,10-09-2025,10/10/2025,Inform customer once order is sent
O173190,C0281,Customer 281,P0824,3,10-18-2025,10-20-2025,
O173191,C0884,Customer 884,P0149,17,16/10/2025,2025-10-17,
O173192,C0653,Customer 653,P0409,6,10-22-2025,10-25-2025,Inform customer once order is sent
O173193,C0665,Customer 665,P0549,10,2025-10-27,11-02-2025,Inform customer once order is sent
O173194,C0205,Customer 205,P0696,11,10-09-2025,18/10/2025,Inform customer once order is sent
O173195,C0621,Customer 621,P0809,7,2025-10-01,10-09-2025,Inform customer once order is sent
O173196,C0239,Customer 239,P0462,4,2025-10-09,2025-10-13,
O173197,C0359,Customer 359,P0897,9,24/10/2025,2025-11-01,Inform customer once order is sent
O173198,C0472,Customer 472,P0076,9,10-10-2025,10-18-2025,
O173199,C0512,Customer 512,P0879,2,2025-10-22,10-25-2025,Inform customer once order is sent
O173200,C0008,Customer 8,P0501,3,10-22-2025,10-25-2025,
O173201,C0269,Customer 269,P0429,20,10-23-2025,24/10/2025,Pay in 90 days
O173202,C0224,Customer 224,P0741,12,2025-10-12,2025-10-13,Inform customer once order is sent
O173203,C0021,Customer 21,P0484,14,27/10/2025,10-29-2025,
O173204,C0354,Customer 354,P0151,19,10-20-2025,30/10/2025,Inform customer once order is sent
O173205,C0439,Customer 439,P0688,8,10-09-2025,2025-10-11,
O173206,C0329,Customer 329,P0164,6,10-12-2025,14/10/2025,
O173207,C0615,Customer 615,P0274,8,2025-10-21,2025-10-27,Inform customer once order is sent
O173208,C0120,Customer 120,P0728,6,22/10/2025,10-31-2025,
O173209,C0286,Customer 286,P0213,2,10-22-2025,2025-10-24,Inform customer once order is sent
O173210,C0800,Customer 800,P0721,8,2025-10-09,2025-10-18,Pay in 90 days
O173211,C0959,Customer 959,P0537,19,17/10/2025,2025-10-26,Inform customer once order is sent
O173212,C0154,Customer 154,P0671,18,2025-10-15,2025-10-17,Pay in 90 days
O173213,C0785,Customer 785,P0067,2,2025-10-19,10-28-2025,Pay in 90 days
O173214,C0895,Customer 895,P0357,15,2025-10-14,10-21-2025,Pay in 90 days
O173215,C0037,Customer 37,P0259,1,10-24-2025,2025-10-28,Inform customer once order is sent
O173216,C0282,Customer 282,P0386,20,10-18-2025,28/10/2025,Inform customer once order is sent
O173217,C0087,Customer 87,P0386,4,03/10/2025,11/10/2025,
O173218,C0887,Customer 887,P0475,10,10-19-2025,25/10/2025,
O173219,C0736,Customer 736,P0062,10,2025-10-20,2025-10-26,
O173220,C0891,Customer 891,P0797,4,10-12-2025,19/10/2025,Pay in 90 days
O173221,C0201,Customer 201,P0455,5,2025-10-18,2025-10-22,
O173222,C0585,Customer 585,P0335,17,2025-10-27,02/11/2025,Inform customer once order is sent
O173223,C0921,Customer 921,P0727,1,13/10/2025,17/10/2025,Inform customer once order is sent
O173224,C0676,Customer 676,P0016,16,2025-10-20,2025-10-22,
O173225,C0607,Customer 607,P0162,13,2025-10-17,24/10/2025,Pay in 90 days
O173226,C0709,Customer 709,P0522,20,20/10/2025,2025-10-21,Inform customer once order is sent
O173227,C0774,Customer 774,P0757,5,13/10/2025,2025-10-21,Inform customer once order is sent
O173228,C0464,Customer 464,P0425,4,10-28-2025,01/11/2025,
O173229,C0624,Customer 624,P0344,20,10-19-2025,2025-10-21,Inform customer once order is sent
O173230,C0765,Customer 765,P0671,18,10-12-2025,13/10/2025,
O173231,C0988,Customer 988,P0162,10,10-08-2025,10-09-2025,Inform customer once order is sent
O173232,C0028,Customer 28,P0750,6,09/10/2025,10-19-2025,
O173233,C0190,Customer 190,P0775,4,10-03-2025,10-10-2025,Pay in 90 days
O173234,C0457,Customer 457,P0693,19,10-10-2025,10-12-2025,Inform customer once order is sent
O173235,C0019,Customer 19,P0810,7,10-10-2025,2025-10-12,
O173236,C0918,Customer 918,P0883,17,10-13-2025,2025-10-18,Inform customer once order is sent
O173237,C0409,Customer 409,P0265,1,10-07-2025,15/10/2025,Pay in 90 days
O173238,C0310,Customer 310,P0079,19,28/10/2025,2025-11-02,Pay in 90 days
O173239,C0516,Customer 516,P0867,2,10-11-2025,10-15-2025,Inform customer once order is sent
O173240,C0823,Customer 823,P0610,19,2025-10-15,2025-10-21,Inform customer once order is sent
O173241,C0040,Customer 40,P0296,15,10-11-2025,17/10/2025,Inform customer once order is sent
O173242,C0991,Customer 991,P0509,12,2025-10-03,10-05-2025,
O173243,C0101,Customer 101,P0190,10,2025-10-19,2025-10-27,Inform customer once order is sent
O173244,C0980,Customer 980,P0587,4,2025-10-11,14/10/2025,Inform customer once order is sent
O173245,C0508,Customer 508,P0093,13,10-25-2025,11-04-2025,
O173246,C0584,Customer 584,P0374,13,04/10/2025,2025-10-14,Inform customer once order is sent
O173247,C0649,Customer 649,P0737,11,2025-10-28,31/10/2025,
O173248,C0841,Customer 841,P0272,15,07/10/2025,10-08-2025,Pay in 90 days
O173249,C0659,Customer 659,P0603,17,2025-10-12,2025-10-21,Inform customer once order is sent
O173250,C0411,Customer 411,P0819,17,10-05-2025,10-06-2025,Pay in 90 days
O173251,C0749,Customer 749,P0018,19,2025-10-07,2025-10-13,
O173252,C0073,Customer 73,P0253,13,2025-10-07,2025-10-15,Pay in 90 days
O173253,C0017,Customer 17,P0571,17,2025-10-23,26/10/2025,Inform customer once order is sent
O173254,C0216,Customer 216,P0570,10,11/10/2025,2025-10-20,Pay in 90 days
O173255,C0930,Customer 930,P0488,11,2025-10-21,30/10/2025,Inform customer once order is sent
O173256,C0050,Customer 50,P0646,2,2025-10-03,2025-10-05,Pay in 90 days
O173257,C0997,Customer 997,P0806,15,18/10/2025,10-24-2025,Inform customer once order is sent
O173258,C0531,Customer 531,P0848,4,2025-10-13,10-20-2025,Inform customer once order is sent
O173259,C0890,Customer 890,P0838,1,10-05-2025,2025-10-15,Pay in 90 days
O173260,C0617,Customer 617,P0623,16,27/10/2025,31/10/2025,Pay in 90 days
O173261,C0384,Customer 384,P0844,3,10-20-2025,24/10/2025,Pay in 90 days
O173262,C0919,Customer 919,P0647,3,11/10/2025,10-12-2025,
O173263,C0307,Customer 307,P0646,20,2025-10-07,13/10/2025,Inform customer once order is sent
O173264,C0825,Customer 825,P0807,6,2025-10-03,2025-10-10,
O173265,C0957,Customer 957,P0681,11,11/10/2025,10-19-2025,Pay in 90 days
O173266,C0905,Customer 905,P0641,8,10-13-2025,19/10/2025,
O173267,C0686,Customer 686,P0383,8,07/10/2025,2025-10-10,Pay in 90 days
O173268,C0394,Customer 394,P0355,10,23/10/2025,2025-10-29,Pay in 90 days
O173269,C0411,Customer 411,P0337,9,2025-10-20,2025-10-22,
O173270,C0681,Customer 681,P0713,2,10-07-2025,10-16-2025,Pay in 90 days
O173271,C0543,Customer 543,P0053,3,2025-10-17,2025-10-21,Inform customer once order is sent
O173272,C0760,Customer 760,P0107,7,2025-10-06,13/10/2025,Pay in 90 days
O173273,C0090,Customer 90,P0859,1,10-23-2025,29/10/2025,Pay in 90 days
O173274,C0733,Customer 733,P0298,4,23/10/2025,2025-11-01,
O173275,C0197,Customer 197,P0282,13,10-10-2025,18/10/2025,Pay in 90 days
O173276,C0794,Customer 794,P0649,14,10-17-2025,2025-10-25,Pay in 90 days
O173277,C0432,Customer 432,P0484,1,10-10-2025,2025-10-15,Inform customer once order is sent
O173278,C0152,Customer 152,P0610,14,2025-10-08,2025-10-14,Inform customer once order is sent
O173279,C0719,Customer 719,P0791,9,23/10/2025,11-01-2025,
O173280,C0991,Customer 991,P0243,13,10-16-2025,19/10/2025,Pay in 90 days
O173281,C0081,Customer 81,P0492,10,2025-10-20,10-25-2025,Inform customer once order is sent
O173282,C0369,Customer 369,P0444,15,15/10/2025,18/10/2025,
O173283,C0784,Customer 784,P0306,19,10-15-2025,25/10/2025,
O173284,C0702,Customer 702,P0878,15,23/10/2025,2025-10-28,Pay in 90 days
O173285,C0050,Customer 50,P0286,14,2025-10-26,2025-10-29,Inform customer once order is sent
O173286,C0584,Customer 584,P0052,17,10-05-2025,10-11-2025,
O173287,C0591,Customer 591,P0891,2,12/10/2025,2025-10-14,
O173288,C0208,Customer 208,P0053,10,2025-10-10,16/10/2025,Inform customer once order is sent
O173289,C0493,Customer 493,P0432,1,28/10/2025,11-02-2025,Inform customer once order is sent
O173290,C0537,Customer 537,P0661,9,10-01-2025,05/10/2025,Inform customer once order is sent
O173291,C0153,Customer 153,P0446,15,05/10/2025,2025-10-11,
O173292,C0059,Customer 59,P0672,16,2025-10-11,10-17-2025,Inform customer once order is sent
O173293,C0530,Customer 530,P0482,9,10-07-2025,10-08-2025,
O173294,C0834,Customer 834,P0367,15,10-17-2025,10-19-2025,Inform customer once order is sent
O173295,C0906,Customer 906,P0068,14,2025-10-26,11-05-2025,
O173296,C0234,Customer 234,P0215,2,2025-10-02,2025-10-11,
O173297,C0067,Customer 67,P0458,12,2025-10-10,2025-10-12,
O173298,C0265,Customer 265,P0800,14,26/10/2025,10-28-2025,Inform customer once order is sent
O173299,C0720,Customer 720,P0882,8,23/10/2025,27/10/2025,
O173300,C0456,Customer 456,P0112,7,03/10/2025,04/10/2025,Inform customer once order is sent
O173301,C0806,Customer 806,P0411,17,02/10/2025,2025-10-04,
O173302,C0804,Customer 804,P0433,11,03/10/2025,10-12-2025,Pay in 90 days
O173303,C0033,Customer 33,P0063,18,2025-10-16,10-20-2025,Pay in 90 days
O173304,C0005,Customer 5,P0375,10,05/10/2025,2025-10-15,Pay in 90 days
O173305,C0368,Customer 368,P0576,14,10-17-2025,2025-10-21,Inform customer once order is sent
O173306,C0289,Customer 289,P0558,5,10-15-2025,2025-10-23,Pay in 90 days
O173307,C0128,Customer 128,P0268,12,24/10/2025,31/10/2025,Inform customer once order is sent
O173308,C0945,Customer 945,P0117,12,10/10/2025,12/10/2025,Inform customer once order is sent
O173309,C0638,Customer 638,P0782,18,14/10/2025,2025-10-19,Pay in 90 days
O173310,C0796,Customer 796,P0860,5,10-25-2025,28/10/2025,
O173311,C0558,Customer 558,P0518,18,2025-10-10,2025-10-19,Pay in 90 days
O173312,C0295,Customer 295,P0390,16,2025-10-26,03/11/2025,Inform customer once order is sent
O173313,C0938,Customer 938,P0357,2,10-23-2025,25/10/2025,Inform customer once order is sent
O173314,C0701,Customer 701,P0093,4,2025-10-27,2025-10-28,Pay in 90 days
O173315,C0337,Customer 337,P0355,20,10-01-2025,2025-10-04,
O173316,C0215,Customer 215,P0617,18,27/10/2025,2025-10-30,
O173317,C0067,Customer 67,P0180,20,2025-10-12,2025-10-22,
O173318,C0840,Customer 840,P0851,19,05/10/2025,12/10/2025,Inform customer once order is sent
